PMID	Title	Abstract
33439995	Renal transplant outcomes in amyloidosis.	BACKGROUND: Outcomes after renal transplantation have traditionally been poor in systemic amyloid A (AA) amyloidosis and systemic light chain (AL) amyloidosis, with high mortality and frequent recurrent disease. We sought to compare outcomes with matched transplant recipients with autosomal dominant polycystic kidney disease (ADPKD) and diabetic nephropathy (DN), and identify factors predictive of outcomes. METHODS: We performed a retrospective cohort study of 51 systemic AL and 48 systemic AA amyloidosis patients undergoing renal transplantation. Matched groups were generated by propensity score matching. Patient and death-censored allograft survival were compared via Kaplan-Meier survival analyses, and assessment of clinicopathological features predicting outcomes via Cox proportional hazard analyses. RESULTS: One-, 5- and 10-year death-censored unadjusted graft survival was, respectively, 94, 91 and 78% for AA amyloidosis, and 98, 93 and 93% for AL amyloidosis; median patient survival was 13.1 and 7.9 years, respectively. Patient survival in AL and AA amyloidosis was comparable to DN, but poorer than ADPKD [hazard ratio (HR) = 3.12 and 3.09, respectively; P < 0.001]. Death-censored allograft survival was comparable between all groups. In AL amyloidosis, mortality was predicted by interventricular septum at end diastole (IVSd) thickness >12 mm (HR = 26.58; P = 0.03), while survival was predicted by haematologic response (very good partial or complete response; HR = 0.07; P = 0.018). In AA amyloidosis, recurrent amyloid was associated with elevated serum amyloid A concentration but not with outcomes. CONCLUSIONS: Renal transplantation outcomes for selected patients with AA and AL amyloidosis are comparable to those with DN. In AL amyloidosis, IVSd thickness and achievement of deep haematologic response pre-transplant profoundly impact patient survival.
38864143	[Acquired cystic kidney hemorrhage in peritoneal dialysis patients: A report of three cases].	Spontaneous renal cyst hemorrhage is one of the clinical emergencies in peritoneal dialysis (PD) patients and is potentially life-threatening. The main complaints are sudden low back pain, paleness, and hypotensive shock with or without vomiting or fever. In contrast to inherited polycystic kidney disease, acquired cystic kidney disease (ACKD) secondary to chronic kidney disease is easily overlooked or delayed in clinical diagnosis and treatment, leading to severe clinical outcomes. We report three patients with spontaneous hemorrhage of ACKD in the peritoneal dialysis center at Peking University First Hospital. The common features are as follows, long history of dialysis, mild to severe low back pain, decrease in hemoglobulin, negative PD solutions, diagnosis established through computed tomography (CT), and continuing PD during treatment of ACKD hemorrhage. Treatments vary from conservative to unilaterally selective renal artery embolization. In this study, ACKD morbidity was investigated in PD patients. A total of 316 patients who had an abdominal ultrasound, CT, or magnetic resonance imaging (MRI) in the past 1 year were enrolled. Among them, 103 cases (32.9%) met the diagnostic criteria of ACKD. The morbidity rates were 27.5%, 37.8%, 43.8%, 59.1%, and 88.6%, when the dialysis history ranged from <=3, >3 & <=5, >5 & <=7, >7 & <=9, >9 years, respectively, showing a increasing trend. Most ACKD hemorrhages could be healed and got an acceptable prognosis after treatment, including rest, blood transfusion, selective renal artery embolization, or nephrectomy. We summarize the risk factors, including a long history of dialysis, anticoagulation or antiplatelet, and inflammation or stones of the urinary system, but with no difference in initial kidney diseases and gender. ACKD hemorrhage mainly includes intracapsular hemorrhage, cyst rupture, and spontaneous retroperitoneal hemorrhage. In addition, we also recommend an adaptive process for spontaneous kidney hemorrhage of diagnosis and treatment in peritoneal dialysis patients. The significance of these cases lies in the fact that patients with ACKD are potentially associated with complications such as cyst hemorrhage and malignancy. Thus, peritoneal dialysis physicians should place great importance on the surveillance of ACKD.
31924636	Long-acting somatostatin analogue treatments in autosomal dominant polycystic kidney disease and polycystic liver disease: a systematic review and meta-analysis.	OBJECTIVES: A number of randomised control trials (RCTs) investigating the effects of long-acting somatostatin analogues in autosomal dominant polycystic kidney disease (ADPKD) and polycystic liver disease (PLD) have been recently reported. We sought to evaluate all available RCTs investigating the efficacy of somatostatin analogues treatment in ADPKD and PLD. DATA SOURCES: Electronic databases; Pubmed, Clincaltrials.gov and Cochrane Central Register of Controlled Trials ELIGIBILITY CRITERIA FOR SELECTING STUDIES: RCTs and randomised cross-over trials comparing the effects of somatostatin analogue treatment with controls in patients with ADPKD or PLD. DATA EXTRACTION AND SYNTHESIS: Data extraction and bias assessments were performed by two independent reviewers between January and May 2019. Outcomes assessed included estimated glomerular filtration rate (eGFR), total kidney volume (TKV), total liver volume (TLV), progression to end stage renal failure (ESRF) and adverse effects. Data were pooled using a random-effects model and reported as relative risk or mean difference with 95% CIs. RESULTS: Meta-analysis was performed of six RCTs or randomised cross-over trials and three secondary analyses. A total of 592 patients were included. Compared with controls, somatostatin analogue treatment significantly reduced TLV (mean difference -0.15 L, 95% CI -0.26 to -0.03, p=0.01). There was no significant effect on TKV (mean difference -0.19 L, 95% CI -0.50 to 0.12, p=0.23) or eGFR (mean difference 0.27 mL/min/1.73 m2, 95% CI -2.03 to 2.57, p=0.82). There was no effect on progression to ESRF. Somatostatin analogues were associated with known adverse effects such as gastrointestinal symptoms. CONCLUSIONS: The available RCT data show improvement in TLV with somatostatin analogue treatment. There was no benefit to TKV or eGFR in patients with ADPKD, while being associated with various side effects. Further studies are needed to assess potential benefit in reducing cyst burden in patients with PLD.
34204582	Molecular Pathophysiology of Autosomal Recessive Polycystic Kidney Disease.	Autosomal recessive polycystic kidney disease (ARPKD) is a rare disorder and one of the most severe forms of polycystic kidney disease, leading to end-stage renal disease (ESRD) in childhood. PKHD1 is the gene that is responsible for the vast majority of ARPKD. However, some cases have been related to a new gene that was recently identified (DZIP1L gene), as well as several ciliary genes that can mimic a ARPKD-like phenotypic spectrum. In addition, a number of molecular pathways involved in the ARPKD pathogenesis and progression were elucidated using cellular and animal models. However, the function of the ARPKD proteins and the molecular mechanism of the disease currently remain incompletely understood. Here, we review the clinics, treatment, genetics, and molecular basis of ARPKD, highlighting the most recent findings in the field.
31464248	Attitudes and perceived barriers toward arteriovenous fistula creation and use in hemodialysis patients in Jordan.	Current guidelines recommend arteriovenous fistula (AVF) as the preferred method of access for hemodialysis (HD) patients; however, its utilization remains low. The attitudes of Jordanian HD patients and perceived barriers toward AVF are unknown and have not been well studied. In-center HD patients in the Jordan Ministry of Health largest dialysis unit were interviewed, and a questionnaire was administered inquiring about their experiences, attitudes, and perceived barriers toward AVF. Of 104 total patients, 93 met the inclusion criteria. Mean age was 50 +- 16 years, with 44% being female. Average body mass index was 25 +- 5. The cause of end-stage renal disease was diabetes mellitus in 28 (30%), hypertension in 28 (30%), and polycystic kidney disease in three (3%). Patients had an average time on dialysis of 72 months (range 1-240). Current method of HD access was AVF in 45 (48%) and central venous catheter in 30 (32%). The most reported perceived cause of no AVF was delayed referral to surgical evaluation in 19 (40%), refusal to undergo AVF surgical procedure in 16 (33%), and poor understanding of disease in 13 (27%). Of the total studied group, only 29 (31%) indicated that they received sufficient education/information about AVF prior to creation of HD access. Seventy-eight patients (84%) reported that they would recommend AVF as method of access for other HD patients. The reason why majority of patients preferred AVF was reported as: easier to care for 51 (65%), better associated hygiene 26 (33%), and perceived less infection risk 24 (31%). In conclusion, in this sample population from HD patients in Jordan, majority would recommend an AVF as mode of access. Perceived barriers include lack of timely referral for vascular surgical evaluation and poor understanding of disease. A systematic assessment of the process that precedes the creation of AVF, with focus on areas of reported barriers may allow for better utilization of AVF.
30497224	Ruptured intracranial aneurysm in a patient with autosomal recessive polycystic kidney disease.	Aneurysmal rupture can result in devastating neurological consequences and can be complicated by comorbid disease processes. Patients with autosomal recessive polycystic kidney disease (ARPKD) have a low rate of reported aneurysms, but this may be due to the relative high rate of end-stage illnesses early in childhood. Authors here report the case of a 10-year-old boy with ARPKD who presented with a Hunt and Hess grade V subarachnoid hemorrhage requiring emergency ventriculostomy, embolization, and decompressive craniectomy. Despite initial improvements in his neurological status, the patient succumbed to hepatic failure. Given the catastrophic outcomes of subarachnoid hemorrhage in young patients, early radiographic screening in those with ARPKD may be warranted.
30509370	Left ventricular dysfunction in ADPKD and effects of octreotide-LAR: A cross-sectional and longitudinal substudy of the ALADIN trial.	BACKGROUND AND AIM: In autosomal dominant polycystic kidney disease (ADPKD) cardiac abnormalities have been observed before the onset of hypertension or renal dysfunction. We sought to characterize, in ADPKD patients, left ventricular (LV) function and its changes after somatostatin-analogue octreotide-LAR treatment. METHODS: In a 1:1:1 cross-sectional study, we evaluated LV function by speckle-tracking echocardiography in 34 ADPKD patients from one ALADIN-trial center and in 34 age- and gender-matched healthy controls and 34 equally-matched renal controls with non-cystic chronic kidney disease. Changes in LV function were compared in the 16 and 18 ADPKD patients originally randomized to 3 year-treatment with octreotide-LAR or placebo, respectively. RESULTS: LV twist and untwisting rates were lower in ADPKD patients that in healthy or renal controls (6.1 +- 2.6  vs. 11.1 +- 2.1  and 10.2 +- 3.7 ; -49.5 +- 18.1 /s vs. -79.8 +- 12.2 /s and -84.3 +- 25.9 /s, respectively, all p < 0.001). The correlation between LV mass or diastolic BP and untwisting rate was positive in ADPKD patients (r = 0.38, p = 0.025 and r = 0.44, p = 0.011, respectively), not significant in healthy controls and negative in renal controls (r = -0.38; p = 0.023 and r = -0.40, p = 0.012, respectively. LV untwisting rate improved from -49.9 +- 18.6 /s to -70.3 +- 27.5 /s with octreotide-LAR, but did not change with placebo (p = 0.027 for treatment effect). At adjusted linear regression analysis, octreotide-LAR therapy emerged as the only independent predictor of untwisting rate improvement at final visit [beta coefficient -0.504 (95% CI -46.905--6.367), p = 0.014]. CONCLUSIONS: In ADPKD patients LV function is early impaired. Somatostatin-analogue therapy might help in preventing or ameliorating LV dysfunction in this population. Clinical Trial Registration http://www.clinicaltrials.gov, NCT0030928.
31711576	Native Nephrectomy in Patients With Autosomal Dominant Polycystic Kidney Disease Evaluated for Kidney Transplantation.	Native nephrectomy (NN) in patients with autosomal dominant polycystic kidney disease (ADPKD) is indicated in cases of recurrent urinary tract infections and hematuria, neoplastic degeneration, and encumbrance. Timing, indication, and surgical approach of NN depends on the symptoms or policy of the center. The aim of our study is to evaluate our experience. In our retrospective study, we included 130 patients with a diagnosis of ADPKD from 530 patients evaluated for renal transplantation from 2011 to 2017. We analyzed the etiologic indication, the timing, and the complications of NN. In our cohort, 53 patients underwent open NN, 85% pre-kidney transplantation (KT), 13% post-KT, and only 1 case simultaneous with KT. In the pre-KT group, indications included: major indication was encumbrance in the. In the post-KT group, the major indication was infection followed by encumbrance, which developed after KT. Complications were: 3 cases of bleeding (1 required relaparotomy, 2 evolved into hematoma and radiological derange); 1 iatrogenic iliac artery injury, which was contextually repaired, and 5 cases of incisional hernia. At 35 +- 7.2 months follow-up, patients' survival was 96%; 1 patient died at the induction of anesthesia and 1 patient from sepsis after double NN and removal of nonfunctional transplanted kidney. NN is not without complications and should be performed when clearly indicated. In our experience, we preferred to perform NN before KT.
29425828	Outcomes of renal transplant from donors with polycystic kidney disease.	INTRODUCTION: Kidneys from donors affected by autosomal-dominant polycystic kidney disease (ADPKD) are, in general, considered unsuitable for transplantation. However, some authors report cases of patients who received kidneys from a deceased ADPKD donor showing encouraging outcomes. Our aim is to provide our experience of a patient with end stage renal failure who received a deceased donor kidney from a 29-year-old who themselves had been diagnosed with ADPKD but well maintained renal function, and to provide a comprehensive review of all the published literature. METHODS: In addition to our case, a literature search (PubMed database, Embase, Cochrane Library) of articles published between 1980 and 2017 was performed. RESULTS: Sixteen cases were identified. Median donor age was 24 (range12-55) years old. Median recipient age was 46 (range 19-72) years old. Fifteen cases had a single kidney transplant and one case had a dual kidney transplant. 13/16 (81%) had immediate function, 2 patients (12.5%) had delayed graft function and one patient (6.25%) had primary non-function. Median graft follow up was 36 months (range 6-180). Median serum creatinine at last follow up was 124 mumol/L (range75-442). Thirteen patients (81%) were still alive with a working renal transplant at last follow up. CONCLUSION: The published literature is encouraging and supports the use of polycystic kidneys from younger deceased donors. Therefore, we believe that if kidneys from ADPKD donors are offered, they should have a full assessment and be considered acceptable for renal donation to recipients who may have a life expectancy of 10 years or less and who are fully informed and have the capacity to consent to receiving a polycystic kidney.
27460786	Percutaneous radiofrequency ablation with contrast-enhanced ultrasonography for solitary and sporadic renal cell carcinoma in patients with autosomal dominant polycystic kidney disease.	BACKGROUND: The aim of this study was to assess the functional and oncologic outcomes of percutaneous radiofrequency ablation (RFA) with contrast-enhanced ultrasonography (CEUS) for renal cell carcinoma in patient with autosomal dominant polycystic kidney. METHODS: We performed a retrospective review of five patients with renal cell carcinoma (RCC) in autosomal dominant polycystic kidney disease (ADPKD) from January 2009 to December 2014 with a media follow-up of 33 months. The tumors were ablated with Cool-tip RFA system under the guidance of CEUS. Routine follow-up included contrast-enhanced computed tomography/magnetic resonance imaging (CT/MRI) and renal function tests. RESULTS: Media diameter of the treated renal tumors was 3.1 cm (range 1.7-5.2 cm). Initial ablation success rate was 4/5. After over 6 months contrast-enhanced CT/MRI follow-up after RFA, no patients experienced local tumor recurrence. No patients required dialysis in the periprocedural period. Minor complications only developed in two cases. There was no significant difference in estimated glomerular filtration rate (eGFR) between pre- and post-RFA. CONCLUSIONS: Our initial experience of this technique for RCC in ADPKD was favorable with good renal function preservation and oncologic outcomes. It may be a good choice for RCC in ADPKD.
36094388	Native nephrectomy and arterial embolization of native kidney in autosomal dominant polycystic kidney disease patients: indications, timing and postoperative outcomes.	INTRODUCTION: Autosomal dominant polycystic kidney disease (ADPKD) is one of the most common causes of a need of renal replacement therapy. The need (elective vs. systematic) and timing of native kidney nephrectomy (before, after or during kidney transplantation) is a matter of debate and alternatives to surgery, mainly transcatheter arterial embolization have been explored. We performed a systematic review to report all available evidence on postintervention outcomes of native nephrectomy and arterial embolization in ADPKD patients. EVIDENCE ACQUISITION: A search on Medline, Embase, and Cochrane databases was performed to identify all studies reporting outcomes of native nephrectomy or arterial embolization in APKDs. EVIDENCE SYNTHESIS: Concerning native nephrectomy, a total of 3626 patients in 37 studies were included with 735, 210 and 2681 patients who underwent native nephrectomy respectively before, after or during kidney transplantation. Major complications were 12.2% in unilateral nephrectomy before transplantation, 25.0% in bilateral nephrectomy before transplantation, 17.7% in unilateral nephrectomy during transplantation, 20.8% in bilateral nephrectomy during transplantation and 23.8% in unilateral and bilateral nephrectomy after transplantation. A total of 230 patients in 7 series of arterial embolization were included. All arterial embolization were performed before transplantation. Mean volume reduction ranged from 36.3% at 3 months to 49% at 6 months. The major postintervention complication rate was 1%. CONCLUSIONS: Unilateral native nephrectomy before kidney transplantation was associated with the lowest major postoperative complication rate and appears to be the preferred strategy. Arterial embolization reduces kidney volume by 49% at 6 months. Arterial embolization could be considered when the reduction in size of the native kidney is not urgent.
28316316	Colonic Diverticulosis and Diverticulitis in Renal Transplant Recipients: Management and Long-Term Outcomes.	Data regarding management of colonic diverticulitis in renal transplant recipients (RTRs) are limited. This study aims to identify prevalence, risk factors, and outcomes in RTRs with colonic diverticulosis and diverticulitis. Between January 2004 and December 2013, all patients who underwent kidney transplantation were analyzed. Among all RTSs, patients who had a pretransplant colonoscopic diagnosis of diverticulosis and patients with a proven attack of diverticulitis were included in our analysis. There were 1578 RTRs with a mean age of 50 +- 14 years at the time of transplantation. Of these, 409 patients had colonoscopic evaluation and 174 (43%) were diagnosed with diverticular disease. Fifteen (0.9%) out of 1578 developed a primary attack of diverticulitis. Two patients underwent a Hartmann's procedure due to perforation. Among 13 patients who were initially treated nonoperatively, 4 required surgery due to refractory diverticulitis (n = 2) and recurrence (n = 2). Tobacco use (59% vs 48%, P = 0.02), increased age (58 vs 51 years, P < 0.0001), diabetes (33% vs 35%, P = 0.03), coronary artery disease (38% vs 22%, P = 0.001), and autosomal dominant polycystic kidney disease etiology (P = 0.04) were more common in RTRs with diverticulosis. Majority of RTRs with diverticulitis can be managed nonoperatively. Surgical treatment is warranted in patients with perforated, persistent, and recurrent diverticulitis. A special care and follow-up may be needed in RTRs with autosomal dominant polycystic kidney disease etiology, smoking history, and coronary artery disease due to higher risk of diverticulosis and subsequent potential diverticulitis.
25348222	Pain in renal disease.	Pain is the presenting symptom in 20 to 30% of patients with autosomal dominant polycystic kidney disease (ADPKD) and occurs in 50 to 60% of patients at some stage of the disease process, but its frequency increases with age and size of the cysts. Back pain is caused by kidney enlargement as well as rupture, hemorrhage, or infection of cysts. Other causes of pain include nephrolithiasis and urinary tract infections (UTIs). Analgesic options for patients with ADPKD include transcutaneous electrical nerve stimulation (TENS), spinal cord stimulation, low-dose opioids, and local anesthetics.
25778853	[End stage renal disease and ventricular arrhythmia. Hemodialysis and hemodiafiltration differently affect ventricular repolarization].	Various factors (hypertension [27%], diabetes mellitus [40%]) and their cardiovascular complications play an important role in the genesis of end stage renal disease. Furthermore, primary kidney diseases (glomerulonephritis, tubulointerstitial nephritis, obstructive uropathy, analgesic nephropathy, polycystic kidney disease, autoimmune diseases) have an unfavorable effect on the cardiovascular outcome of this particular population. Increased susceptibility for arrhythmias may be caused by intermittent volume overload, metabolic disturbance, renal anemia, structural and electrophysiological changes of the myocardium, inflammatory mechanisms that may worsen the mortality statistics of these patients. A novel renal replacement method, hemodiafiltration - based on a convective transport - ensures reduced mortality that may be attributed to a decreased occurrence of arrhythmias. The aim of this paper is to review the pathogenetic factors taking part in the arrhythmogenesis of end stage renal disease and to provide diagnostic and therapeutic opportunities that can help in the prediction and prevention of arrhythmias.
