PMID	Title	Abstract
33573817	Risk Factors, Diagnosis, and Treatment of Lymphocele After Renal Transplantation: A Retrospective Study.	INTRODUCTION: Despite recent advances, lymphoceles are the most frequent complications following renal transplantation (RT), with an incidence of 0.6% to 51%. In this study, we present risk factors, treatments, and outcomes for lymphoceles after RT at our center. MATERIAL AND METHODS: Since January 2018, 461 RTs were performed at our center. Nine recipients were excluded. The remaining 452 RTs were analyzed retrospectively. Recipients were divided into 2 groups: a lymphocele group (n = 29) and a nonlymphocele group (n = 423). Lymphoceles were diagnosed by ultrasound. Statistical analyses were made using the SPSS 15 software program. RESULTS: Twenty-nine (6.4%) of the 452 recipients developed lymphoceles. Seven of these 29 (24.1%) recipients were asymptomatic. The most common symptom was hydronephrosis (34.4%). Percutaneous drainage was performed in 21 recipients; sclerotherapy with percutaneous drainage was used in the remaining 8. In 5 (17.2%) recipients, there was a recurrence of lymphoceles. There were significant differences with respect to age (50-65 years; P = .016), use of a drainage catheter (P = .044), and polycystic kidney diseases (P = .049). CONCLUSION: Lymphoceles can be treated successfully using the percutaneous drainage technique alone or in combination with povidone iodine. Drainage use, polycystic kidney disease, and age (50-65 years) were established as risk factors for lymphocele development.
39289130	Core Patient-Reported Outcomes for Trials in Nephrology.	The outcomes reported in trials across all stages of chronic kidney disease (CKD) are highly variable and often do not include outcomes that are directly relevant to patients and caregivers. Frequently, the outcomes reported in trials are often unvalidated surrogate biochemical end points. The omission of outcomes that are meaningful and important to patients can diminish the value of trials in supporting treatment decisions. In response, there have been increasing efforts across many health and medical disciplines to develop core outcome sets, defined as the minimum set of outcomes to be reported in all trials in a specific health area to improve the relevance and consistency of reporting trial outcomes. The international Standardized Outcomes in Nephrology (SONG) initiative was established in 2014 and has since developed seven core outcome sets for different diagnosis and treatment stages of CKD. The core outcomes were based on consensus among patients, caregivers, and health professionals. Each core outcome set includes at least one patient-reported outcome, including fatigue (hemodialysis), life participation (kidney transplantation, peritoneal dialysis, early CKD not yet requiring kidney replacement therapy, children and adolescents, and glomerular disease), and pain (polycystic kidney disease). This article outlines how patient-reported outcomes are currently reported in trials, discusses core patient-reported outcomes that have been established for trials in kidney disease, and outlines strategies for implementing core patient-reported outcomes in trials.
29145282	Autosomal dominant polycystic kidney disease combined with hypertrophic cardiomyopathy: A case report.	INTRODUCTION: This report describes the novel sampling of autosomal dominant polycystic kidney disease (ADPKD) combined with hypertrophic cardiomyopathy (HCM). SYMPTOMS AND CLINICAL FINDINGS: A 48-year-old Chinese man presented with anasarca, hypourocrinia, gross hematuria, and weight gain by 10 kg subsequently developed acute kidney injury after struck by acute respiratory distress syndrome, really a threat to his heart. DIAGNOSES: Abdominal ultrasound revealed multiple small cysts in both kidneys, with the right kidney measuring 11.6 cm in length, and the left kidney measuring 11.5 cm in length, which supported ADPKD. Echocardiography showed left ventricular posterior wall thickness measuring 15.2 mm, interventricular septum measuring 17.2 mm, left atrial size 31.9 mm, ejection fraction measuring 69%, approving the diagnose of HCM. THERAPEUTICS INTERVENTIONS: Because of the failure treatment with tripterygium wilfordii and valsartan, the patient was administered with prednisone 1 mg/kg/day. Continuous renal replacement therapy was required to prevent heart and kidney from failure. OUTCOMES: The patient responded well and his renal function improved. CONCLUSION: This is the first reported case of ADPKD with HCM, with complete remission of acute kidney injury and preservation of cardiac function. Serial checks and measures should be considered for appropriate treatment of ADPKD patient who present with rapid decline of renal function. We present detailed analysis of the patient's disease course and review literature. Written informed consent was obtained from the patient for publication of this case report. It has been permitted by Committee on Ethics of Biomedicine, Second Military Medical University.
29133541	Autosomal dominant polycystic kidney disease.	
25905984	Intravitreal Antivascular Endothelial Growth Factor Therapy May Induce Proteinuria and Antibody Mediated Injury in Renal Allografts.	INTRODUCTION: Systemic adverse effects of intravenous antivascular endothelial growth factor (VEGF) therapy include: hypertension, proteinuria, renal failure, and thrombotic microangiopathy. Intravitreal therapy with these agents is generally believed to be safe. METHODS: We report 2 cases of renal transplant recipients who developed significant allograft dysfunction after the initiation of intravitreal anti-VEGF therapy. RESULTS: The first case is a 67-year-old man with polycystic kidney disease and recipient of a zero-antigen mismatch kidney allograft which developed worsening proteinuria over the first year after transplantation. At 4 months, a biopsy showed only minimal fibrosis and atrophy. At 1 year, an allograft biopsy showed phospholipase A 2 receptor-negative membranous nephropathy. The second patient was a 52-year-old man with tuberous sclerosis who was a recipient of a living related kidney allograft with diminished but stable graft function 16 years from transplantation. After the initiation of intravitreal anti-VEGF therapy, there was an escalating degree of proteinuria. Renal biopsy revealed acute and chronic antibody-mediated rejection with glomerular thrombi and transplant glomerulopathy. CONCLUSIONS: These cases, although do not prove causality, point to the need for careful follow-up of renal transplant recipients undergoing intravitreal therapy with anti-VEGF agents. These locally administered agents may play a role in the development of proteinuria and modulate antibody-mediated phenomena. We recommend that in renal transplant recipients undergoing therapy with intravitreal anti-VEGF agents, proteinuria be checked monthly, and there should be a low threshold for performing a biopsy to evaluate for allograft injury.
36128601	Utilizing the same incision for staged renal transplant in patients with polycystic kidney disease requiring hand-assisted laparoscopic nephrectomy.	BACKGROUNDS: Many autosomal dominant polycystic kidney disease (ADPKD) patients undergo nephrectomy and subsequent renal transplantation. We report our outcomes after hand-assisted laparoscopic nephrectomy (HALN) where a Rutherford-Morrison incision is used as a hand-port site and kidney extraction site, as well the future incision site for staged transplantation. METHODS: A retrospective review was performed on all adult nephrectomies for ADPKD by the Transplant Surgery department at Westmead Hospital between June 2011 and June 2021. Outcomes were compared between HALN, laparoscopic nephrectomy (LN) and open nephrectomy (ON) including operation time, hospital length of stay (LOS), post-operative complications, subsequent transplantation and post-transplantation wound complications. RESULTS: Twenty-two HALN, 8 LN and 5 ON were performed during the study period. Median kidney weights for HALN, LN and ON were significantly different (1575, 403, 3420 g respectively, P = 0.001). There was a significant difference in LOS between the HALN and ON (5.8 versus 9.8 days, P = 0.04), but not between HALN and LN (5.8 versus 5.1, P = 0.06). There was no significant difference for operation time (P = 0.34) and major complication rates (P = 0.58). There were 8 HALN, 5 LN and 2 ON who have had subsequent renal transplantation with one wound complication, an incisional hernia in the HALN group. CONCLUSION: Our HALN is associated with a shorter LOS and similar complication rate to ON and can be efficiently performed for significantly larger kidneys than LN without a significant difference in operation time or LOS. The same Rutherford-Morrison incision site can be used for transplantation.
38427307	Elevated hemoglobin levels in renal transplant recipients with polycystic kidney disease versus other etiologies: exploring mechanisms and implications for outcomes.	BACKGROUND: Autosomal dominant polycystic kidney disease (ADPKD)-related end-stage kidney disease (ESKD) often necessitates transplantation. However, the impact of ADPKD on post-transplant outcomes, specifically hemoglobin levels, remains unknown. METHODS: We retrospectively analyzed 513 Kidney Transplant Recipients (KTRs), of whom 81 had ESKD due to ADPKD (20 with pre-transplant native nephrectomy and 61 without). Hemoglobin levels were evaluated at multiple time intervals post-transplant. RESULTS: Kidney transplant recipients with ADPKD vs. KTRs with ESKD due to other causes exhibited significantly higher hemoglobin levels in repeated measurement analysis. Multivariable analyses confirmed ADPKD as an independent predictor for elevated hemoglobin levels. In a multivariable logistic regression analysis, the odds for maximum hemoglobin > 15 mg/dL at 3-12 months post-transplant were more than twice as high in ADPKD patients vs. all the other KTRs (Odds Ratio [OR] 2.31, 95% Confidence Interval [CI] 1.3-4.13, p < 0.001). Pre-transplant native nephrectomy revealed a trend toward lower hemoglobin levels. Elevated hemoglobin levels were linked to improved estimated glomerular filtration rate (eGFR) at one year post-transplant. Patient survival was enhanced among KTRs with ADPKD compared to other ESKD causes. CONCLUSIONS: Kidney transplant recipients with ADPKD exhibited elevated hemoglobin levels post-transplant, possibly due to prolonged native kidney erythropoietin production. These elevated hemoglobin levels were linked to improved outcomes, including allograft function and patient survival. Future research should further investigate the underlying mechanisms driving favorable ADPKD KTR outcomes.
37875772	Complications and prognosis of patients diagnosed with autosomal recessive polycystic kidney disease in neonatal period.	There are no clinical guidelines for performing nephrectomy in patients with autosomal recessive polycystic kidney disease (ARPKD). Few reports have described the clinical course of ARPKD diagnosed in the neonatal period in detail. Here, we report seven patients diagnosed with ARPKD and treated at our center during the neonatal period. Two died within 48 h of life due to pulmonary hypoplasia. Of the remaining five patients, three had anuria and required for kidney replacement therapy (KRT) within one week after birth, whereas two with a milder phenotype survived without KRT. All three patients who received KRT underwent unilateral nephrectomy and peritoneal dialysis (PD) catheter placement. To prevent fluid leakage, PD was initiated 7-14 days after catheter placement. However, peritoneal leakage occurred in two patients, resulting in peritonitis and discontinuation of PD; one who required long-term hemodialysis contracted a catheter-related bloodstream infection as well as developed subdural and epidural hematomas. Meanwhile, two patients underwent a second nephrectomy within 6 weeks after birth; one developed severe persistent hypotension and neurological complications, while the other died of bacteremia that may have resulted from cholangitis diagnosed on day 67 of life. A severe clinical course, life-threatening adverse events, and severe neurological sequalae may occur in patients with ARPKD who receive KRT in neonatal period.
30910370	Oxalosis Associated With High-Dose Vitamin C Ingestion in a Peritoneal Dialysis Patient.	We report a case of systemic oxalosis involving the eyes and joints due to long-term use of high-dose vitamin C in a patient receiving maintenance peritoneal dialysis (PD). This 76-year-old woman with autosomal dominant polycystic kidney disease underwent living unrelated kidney transplantation 10 years earlier. The transplant failed 6 months before presentation, and she initiated hemodialysis therapy before transitioning to PD therapy 4 months later. During the month before presentation, the patient noted worsening arthralgias and decreased vision. Ophthalmologic examination revealed proliferative retinopathy and calcium oxalate crystals. Plasma oxalate level was markedly elevated at 187 (reference range, <1.7) mumol/L, and urine oxalate-creatinine ratio was high (0.18mg/mg). The patient reported taking up to 4g of vitamin C per day for several years. Workup for causes of primary and secondary hyperoxaluria was otherwise negative. Vitamin C use was discontinued, and the patient transitioned to daily hemodialysis for 2 weeks. Plasma oxalate level before the dialysis session decreased but remained higher (30-53mumol/L) than typical for dialysis patients. Upon discharge, the patient remained on thrice-weekly hemodialysis therapy with stabilized vision and improved joint symptoms. This case highlights the risk of high-dose vitamin C use in patients with advanced chronic kidney disease, especially when maintained on PD therapy.
27998045	How can a vascular surgeon help in kidney transplantation.	Kidney transplantation is a surgical procedure involving both vascular and ureteric anastomoses. As a matter of fact, it can be performed either by urologists or vascular surgeons. However, vascular surgeon's expertise can be helpful at different times. In the present paper we describe how can vascular surgeons help at the different stages of kidney transplantation process in modern care: 1) before kidney transplantation for recipient preparation in order to allow subsequent graft implantation, either by performing percutaneous embolization of renal arteries in the setting of polycystic kidney disease or treatment of aneurysmal or occlusive lesions that would contra-indicate graft implantation; 2) at the time of surgery graft back table preparation and repair; and 3) after surgery for long-term follow-up, including transplant renal artery stenosis treatment or transplant nephrectomy.
35422167	Supine PCNL in autosomal dominant polycystic kidney disease.	AIMS AND OBJECTIVES: Standard percutaneous nephrolithotomy (PCNL) has routinely been performed in prone position in autosomal dominant polycystic kidney disease (ADPKD) with nephrolithiasis. The objectives of our present study is to ensure optimum access to the renal collecting system, reducing operative time, and anesthetic morbidity during supine PCNL in ADPKD with nephrolithiasis. METHODS: Seven patients were selected randomly. There were no preference for age, gender, size, location and laterality of stone, or BMI . All the patients fit into the AUA guideline criteria for management by percutaneous nephrolithotomy. Preoperative, perioperative, and follow up data were collected prospectively. RESULTS: Seven patients underwent supine PCNL in approximately 2.5 year in modified supine position. There was no intraoperative, post operative, or on follow up complications in any patient. In all the patients stones were cleared completely in single sitting. CONCLUSIONS: Supine PCNL in ADPKD with nephrolithiasis is an alternative with similar outcomes to the standard prone PCNL. It provides an additional benefit of performing the procedure in a single position, which is known to reduce total operating time, less anesthesia related complications, less neuromusculoskeletal injury, and reduce physical strain on operating.
35845334	Pretransplant Dialysis and Preemptive Transplant in Living Donor Kidney Recipients.	Background: The optimal timing of dialysis access placement in individuals with stage 5 CKD is challenging to estimate. Preemptive living donor kidney transplant (LDKT) is the gold-standard treatment for ESKD due to superior graft survival and mortality, but dialysis initiation is often required. Among LDKT recipients, we sought to determine which clinical characteristics were associated with preemptive transplant. Among non-preemptive LDKT recipients, we sought to determine what dialysis access was used, and their duration of use before receipt of living donor transplant. Methods: We retrospectively extracted data on 569 LDKT recipients, >18 years old, who were transplanted between January 2014 and July 2019 at UCSF, including dialysis access type (arteriovenous fistula [AVF], arteriovenous graft [AVG], peritoneal dialysis catheter [PD], and venous catheter), duration of dialysis, and clinical characteristics. Results: Preemptive LDKT recipients constituted 30% of our cohort and were older, more likely to be White, more likely to have ESKD from polycystic kidney disease, and less likely to have ESKD from type 2 diabetes. Of the non-preemptive patients, 26% used AVF, 0.5% used AVG, 32% used peritoneal catheter, 11% used venous catheter, and 31% used more than one access type. Median (IQR) time on dialysis for AVF/AVG use was 1.86 (0.85-3.32) years; for PD catheters, 1.12 (0.55-1.92) years; for venous catheters, 0.66 (0.23-1.69) years; and for multimodal access, 2.15 (1.37-3.72) years. Conclusions: We characterized the dialysis access landscape in LDKT recipients. Venous catheter and PD were the most popular modality in the first quartile of dialysis, and patients using these modalities had shorter times on dialysis compared with those with an AVF. Venous catheter or PD can be considered a viable bridge therapy in patients with living donor availability given their shorter waitlist times. Earlier referral of patients with living donor prospects might further minimize dialysis need.
38511986	Laparoscopic Nephrectomy Via the Retroperitoneal Approach for Autosomal Dominant Polycystic Kidney Disease After Renal Transplant: A Case Report.	We report a case of laparoscopic nephrectomy via the retroperitoneal approach for autosomal dominant polycystic kidney disease after renal transplant. A 54-year-old male patient with end-stage renal failure because of autosomal dominant polycystic kidney disease underwent a living donor renal transplant and right nephrectomy via open surgery through a median abdominal incision 5 years previously. However, the left kidney gradually became enlarged. We performed laparoscopic left nephrectomy via the retroperitoneal approach. After dissecting the renal vessels, we performed cyst puncture and aspiration to decrease the kidney volume. The patient's symptoms improved after operation. Laparoscopic nephrectomy for enlarged kidneys with multiple cysts can be safely performed, and the retroperitoneal approach can be preferred if the patient has a history of abdominal surgery or an enlarged polycystic kidney.
29108517	Inferior Long-Term Outcomes for Kidney Transplant Recipients With an Immunologically Mediated Primary Renal Disease.	OBJECTIVES: Recurrent glomerulonephritis can negatively affect kidney allograft survival. However, how primary renal disease affects transplant outcomes in the new era of immunosuppression remains unclear. MATERIALS AND METHODS: We categorized 426 kidney transplant recipients (performed from 1996 to 2007) into 4 disease groups: (1) 99 recipients with biopsy-proven immunologically mediated kidney disease, (2) 40 recipients with urologic disease, (3) 67 recipients with polycystic kidney disease, and (4) 220 recipients with other causes of terminal renal failure/uncertain kidney disease. Long-term transplant outcomes were compared between groups at 1, 5, and 10 years of follow-up. RESULTS: Compared with the urologic, polycystic, and other diseases groups, the immunologic group showed significantly lower time of graft survival (9.5 +- 4 vs 8 +- 4 vs 8.5 +- 4 vs 7 +- 4 years, respectively) and estimated glomerular filtration rate (52.5 +- 32 vs 49 +- 22 vs 50 +- 32 vs 35.5 +- 30 mL/min; P < .05). Relative risk of 10-year graft loss for the immunologic group was 2.8 (95% confidence interval, 1.6-4.9). Recurrence rate was 12% in the immunologic group versus 1% and 0% in the other diseases and remaining groups (P < .05). The relative risk of 10-year graft loss for patients with recurrence was 2.7 (95% confidence interval, 1.2-6.3). Ten-year graft loss rates for patients with biopsy-proven acute rejection, chronic allograft nephropathy, and recurrent glomerulonephritis were 30%, 23%, and 42% (P < .05). For those with biopsy-proven recurrent glomerulonephritis, 10-year estimated glomerular filtration rate was significantly lower than for those with biopsy-proven acute rejection or chronic allograft nephropathy (14 +- 6 vs 18 +- 7 vs 30 +- 10 mL/min; P < .05). CONCLUSIONS: Kidney transplant recipients with immunologically mediated kidney diseases have inferior long-term allograft survival and function versus patients with other causes of renal failure. Recurrence represents the strongest risk factor for premature loss of function and transplant failure.
25973696	Pre-transplant angiotensin receptor II type 1 antibodies and risk of post-transplant focal segmental glomerulosclerosis recurrence.	Post-kidney transplant recurrence of focal segmental glomerulosclerosis (FSGS) is a major problem. AT1R is expressed on podocyte; its expression is elevated in the proteinuric state. Using an ELISA, we tested pre-transplant sera of 28 patients with history of idiopathic FSGS for anti-AT1R levels and serum soluble urokinase-type plasminogen activator receptor (suPAR) as a biomarker for risk of recurrence of FSGS. Sera from 11 patients with polycystic kidney disease (PKD) were used as controls. Twelve patients had biopsy proven post-transplant FSGS recurrence at 1.5 months. No difference was found in the pre-transplant suPAR levels of FSGS patients (5993 +- 2292 pg/mL) vs. PKD (7334 +- 4538 pg/mL) (p = 0.23). Serum suPAR levels in patients with FSGS recurrence (5786 +- 1899 pg/mL) vs. no FSGS recurrence (6149 +- 2598 pg/mL) (p = 0.69) were not different. Anti-AT1R levels in patients with FSGS were 12.66 +- 11.85 U/mL vs. 8.69 +- 6.52 U/mL in PKD (p = 0.32); however, a difference was found in patients with and without FSGS recurrence 20.41 +- 14.36 U/mL 6.84 +- 4.181 U/mL, respectively (p < 0.01). Area under curve for suPAR and anti-AT1R to predict post-transplant FSGS recurrence was 0.51 and 0.84, respectively. Pre-transplant anti-AT1R levels appear to be a helpful biomarker in identifying patients at high risk of post-transplant FSGS recurrence.
24550663	Successful pregnancy in a patient with autosomal dominant polycystic kidney disease on long-term hemodialysis.	Recent advances in dialysis and a multidisciplinary approach to pregnant patients with advanced chronic kidney disease provide a better outcome. A 38-yr-old female with autosomal dominant polycystic kidney disease (ADPKD) became pregnant. She was undergoing hemodialysis (HD) and her kidneys were massively enlarged, posing a risk of intrauterine fetal growth restriction. By means of intensive HD and optimal management of anemia, pregnancy was successfully maintained until vaginal delivery at 34.5 weeks of gestation. We discuss the special considerations involved in managing our patient with regard to the underlying ADPKD and its influence on pregnancy. 
34462140	Between a Rock and a Hard Place-Colonic Obstruction Between Two Kidneys: A Case Report.	We report a case of a 70-year-old woman with a history of end-stage renal disease secondary to polycystic kidney disease with a previous failed transplant who presented for a cadaveric extraperitoneal renal transplant. The patient developed a progressively worsening bowel obstruction postoperatively and evidence of an obstruction was observed on computed tomography imaging with a transition point at the level of the sigmoid colon. Consequent to this, she underwent an exploratory laparotomy, which revealed kinking of the colon secondary to the compression between the transplanted and the left native polycystic kidneys. There were adhesive bands between the native kidney and the descending colon in the retroperitoneal space maintaining it in a fixed position mechanically. The addition of a retroperitoneal transplant exacerbated this kink and was responsible for the bowel obstruction. Her left colon was completely mobilized to relieve her obstruction, and owing to her bowel distension, her abdomen was left open for 2 days before returning to the operating room to remove her left native polycystic kidney to allow space for safe closure. This report highlights an extremely unusual cause of large bowel obstruction post-kidney transplantation.
