PMID	Title	Abstract
30422235	Effect of Lanreotide on Kidney Function in Patients With Autosomal Dominant Polycystic Kidney Disease: The DIPAK 1 Randomized Clinical Trial.	Importance: Autosomal dominant polycystic kidney disease (ADPKD) is characterized by progressive cyst formation in both kidneys and loss of renal function, eventually leading to a need for kidney replacement therapy. There are limited therapeutic management options. Objective: To examine the effect of the somatostatin analogue lanreotide on the rate of kidney function loss in patients with later-stage ADPKD. Design, Setting, and Participants: An open-label randomized clinical trial with blinded end point assessment that included 309 patients with ADPKD from July 2012 to March 2015 at 4 nephrology outpatient clinics in the Netherlands. Eligible patients were 18 to 60 years of age and had an estimated glomerular filtration rate (eGFR) of 30 to 60 mL/min/1.73 m2. Follow-up of the 2.5-year trial ended in August 2017. Interventions: Patients were randomized to receive either lanreotide (120 mg subcutaneously once every 4 weeks) in addition to standard care (n = 153) or standard care only (target blood pressure <140/90 mm Hg; n = 152). Main Outcomes and Measures: Primary outcome was annual change in eGFR assessed as slope through eGFR values during the 2.5-year treatment phase. Secondary outcomes included change in eGFR before vs after treatment, incidence of worsening kidney function (start of dialysis or 30% decrease in eGFR), change in total kidney volume and change in quality of life (range: 1 [not bothered] to 5 [extremely bothered]). Results: Among the 309 patients who were randomized (mean [SD] age, 48.4 [7.3] years; 53.4% women), 261 (85.6%) completed the trial. Annual rate of eGFR decline for the lanreotide vs the control group was -3.53 vs -3.46 mL/min/1.73 m2 per year (difference, -0.08 [95% CI, -0.71 to 0.56]; P = .81). There were no significant differences for incidence of worsening kidney function (hazard ratio, 0.87 [95% CI, 0.49 to 1.52]; P = .87), change in eGFR (-3.58 vs -3.45; difference, -0.13 mL/min/1.73 m2 per year [95% CI, -1.76 to 1.50]; P = .88), and change in quality of life (0.05 vs 0.07; difference, -0.03 units per year [95% CI, -0.13 to 0.08]; P = .67). The rate of growth in total kidney volume was lower in the lanreotide group than the control group (4.15% vs 5.56%; difference, -1.33% per year [95% CI, -2.41% to -0.24%]; P = .02). Adverse events in the lanreotide vs control group included injection site discomfort (32% vs 0.7%), injection site papule (5.9% vs 0%), loose stools (91% vs 6.6%), abdominal discomfort (79% vs 20%), and hepatic cyst infections (5.2% vs 0%). Conclusions and Relevance: Among patients with later-stage autosomal dominant polycystic kidney disease, treatment with lanreotide compared with standard care did not slow the decline in kidney function over 2.5 years of follow-up. These findings do not support the use of lanreotide for treatment of later-stage autosomal dominant polycystic kidney disease. Trial Registration: ClinicalTrials.gov Identifier: NCT01616927.
39203812	Ketogenic Interventions in Autosomal Dominant Polycystic Kidney Disease: A Comprehensive Review of Current Evidence.	Autosomal Dominant Polycystic Kidney Disease (ADPKD) is a genetic disorder characterized by the development and enlargement of multiple kidney cysts, leading to progressive kidney function decline. To date, Tolvaptan, the only approved treatment for this condition, is able to slow down the loss of annual kidney function without stopping the progression of the disease. Furthermore, this therapy is approved only for patients with rapid disease progression and its compliance is problematic because of the drug's impact on quality of life. The recent literature suggests that cystic cells are subject to several metabolic dysregulations, particularly in the glucose pathway, and mitochondrial abnormalities, leading to decreased oxidative phosphorylation and impaired fatty acid oxidation. This finding paved the way for new lines of research targeting potential therapeutic interventions for ADPKD. In particular, this review highlights the latest studies on the use of ketosis, through ketogenic dietary interventions (daily calorie restriction, intermittent fasting, time-restricted feeding, ketogenic diets, and exogenous ketosis), as a potential strategy for patients with ADPKD, and the possible involvement of microbiota in the ketogenic interventions' effect.
25933820	Molecular pathways and therapies in autosomal-dominant polycystic kidney disease.	Autosomal-dominant polycystic kidney disease (ADPKD) is the most prevalent inherited renal disease, characterized by multiple cysts that can eventually lead to kidney failure. Studies investigating the role of primary cilia and polycystins have significantly advanced our understanding of the pathogenesis of PKD. This review will present clinical and basic aspects of ADPKD, review current concepts of PKD pathogenesis, evaluate potential therapeutic targets, and highlight challenges for future clinical studies. 
31261130	Clinical relevance of short-term follow-up of unruptured intracranial aneurysms.	OBJECTIVE: Unruptured intracranial aneurysms are common incidental findings on brain imaging. Short-term follow-up for conservatively treated aneurysms is routinely performed in most cerebrovascular centers, although its clinical relevance remains unclear. In this study, the authors assessed the extent of growth as well as the rupture risk during short-term follow-up of conservatively treated unruptured intracranial aneurysms. In addition, the influence of patient-specific and aneurysm-specific factors on growth and rupture risk was investigated. METHODS: The authors queried their prospective institutional neurovascular registry to identify patients with unruptured intracranial aneurysms and short-term follow-up imaging, defined as follow-up MRA and/or CTA within 3 months to 2 years after initial diagnosis. Medical records and questionnaires were used to acquire baseline information. The authors measured aneurysm size at baseline and at follow-up to detect growth. Rupture was defined as a CT scan-proven and/or CSF-proven subarachnoid hemorrhage (SAH). RESULTS: A total of 206 consecutive patients with 267 conservatively managed unruptured aneurysms underwent short-term follow-up at the authors' center. Seven aneurysms (2.6%) enlarged during a median follow-up duration of 1 year (range 0.3-2.0 years). One aneurysm (0.4%) ruptured 10 months after initial discovery. Statistically significant risk factors for growth or rupture were autosomal-dominant polycystic kidney disease (RR 8.3, 95% CI 2.0-34.7), aspect ratio > 1.6 or size ratio > 3 (RR 10.8, 95% CI 2.2-52.2), and initial size >= 7 mm (RR 10.7, 95% CI 2.7-42.8). CONCLUSIONS: Significant growth of unruptured intracranial aneurysms may occur in a small proportion of patients during short-term follow-up. As aneurysm growth is associated with an increased risk of rupture, the authors advocate that short-term follow-up is clinically relevant and has an important role in reducing the risk of a potential SAH.
31910463	Dialysis in Pregnancy: Role of the Underlying Cause of Renal Failure on Peripartum Outcomes.	OBJECTIVE: Pregnancy on dialysis is rare and few studies in this population exist. Currently, pregnancy outcomes are thought to be related to dialysis intensity. We hypothesize women requiring dialysis due to diabetes or lupus will have worse pregnancy outcomes compared with other indications for dialysis. STUDY DESIGN: All women receiving dialysis during pregnancy from 2012 to 2016 in a single health system were identified. Differences in perinatal outcomes among those with renal failure caused by diabetes or lupus and with other causes were evaluated. RESULTS: Sixteen women were identified, seven with diabetes or lupus causing renal failure; the remaining nine women had hypertension, focal segmental glomerular sclerosis, polycystic kidney disease, congenital hypoplastic kidneys, or neurogenic bladder. The rates of composite maternal morbidity were similar among the two groups. Composite neonatal morbidity was higher in those with renal failure caused by diabetes or lupus compared with other causes (100% vs. 29%, p = 0.028). CONCLUSION: Despite similar dialysis intensity, the composite neonatal morbidity was higher in women with renal failure caused by diabetes or lupus compared with other etiologies. Our findings suggest that pregnancy outcome in women receiving dialysis is dependent on both the intensity of dialysis as well as the etiology of renal failure.
38548511	Safety of Docetaxel in a Patient with Metastatic Castration-Resistant Prostate Cancer After Kidney Transplantation: A Case Report.	BACKGROUND: There are limitations in treating advanced prostate cancer (PC), especially castration-resistant (CR) cases, in renal transplant recipients (RTRs). We describe the case of RTR with metastatic CRPC (mCRPC) treated with docetaxel. CASE REPORT: A 60-year-old man with end-stage renal disease due to autosomal-dominant polycystic kidney disease (ADPKD) underwent living-related kidney transplantation. A year later, he was diagnosed with PC (prostate-specific antigen level: 998 ng/mL). Prostate biopsy revealed prostatic adenocarcinoma with a Gleason score of 4 + 4 = 8. Radiographic examination revealed seminal vesicle invasion and multiple bone and lymph node metastases. Combined androgen blockade therapy was initiated; however, the patient was diagnosed with CRPC 6 months later. Triweekly docetaxel therapy was administered 28 months after diagnosis. The patient successfully completed 7 cycles of this therapy without major adverse events. However, after the 7th cycle, he developed a high fever caused by an infection of ADPKD-associated renal cysts. Therefore, docetaxel was discontinued, and enzalutamide was started, followed by abiraterone, but without any effect. We then introduced cabazitaxel but discontinued it because of hepatic dysfunction. Hence, the patient underwent a docetaxel rechallenge. He was administered the PEGylated form of the recombinant human granulocyte colony-stimulating factor for neutropenia prophylaxis. After 6 cycles of rechallenge docetaxel therapy, the patient accidentally fell, resulting in a cervical spine fracture and subsequent death due to respiratory failure. CONCLUSIONS: Docetaxel can be safely delivered to patients with CRPC after renal transplantation who are taking oral immunosuppressants. It can be a good treatment option for them.
26482029	Ursodeoxycholic Acid for Treatment of Enlarged Polycystic Liver.	Patients with autosomal dominant polycystic kidney disease and polycystic liver disease (PLD) often have elevated serum levels of alkaline phosphatase (ALP) and gamma-glutamyl transpeptidase (GGT). Ursodeoxycholic acid (UDCA) is used to treat biliary tract diseases, but its effect on PLD remains unclear. UDCA was administered for 1 year at a dose of 300 mg daily to seven PLD patients with elevated ALP or GGT levels who were selected for this treatment by experienced clinicians. Laboratory data and liver volumes were compared among three time points: 1 year before UDCA treatment, at the start of UDCA therapy, and 1 year after the start of therapy. Median GGT did not show a significant change between 1 year before UDCA (180 IU/L) and the start of UDCA therapy (209 IU/L), but it decreased significantly to 98 IU/L after 1 year of UDCA therapy (P = 0.015 vs. the start of therapy). ALP showed a significant increase from 1 year before UDCA (456 IU/L) to the start of UDCA therapy (561 IU/L), and then decreased significantly after 1 year of UDCA therapy (364 IU/L). Median liver volume did not show any significant changes among these three time points of assessment. UDCA may be effective for reducing biliary enzyme levels and inhibiting the growth of liver cysts in patients with PLD. 
29743334	Randomised controlled trial of high versus ad libitum water intake in patients with autosomal dominant polycystic kidney disease: rationale and design of the DRINK feasibility trial.	"INTRODUCTION: Vasopressin stimulates cyst growth in autosomal dominant polycystic kidney disease (ADPKD) leading to enlarged kidneys, hypertension and renal failure. Vasopressin receptor blockade slows disease progression. Physiological suppression of vasopressin secretion through high water (HW) intake could achieve a similar effect, necessitating a definitive large-scale trial of HW intake in ADPKD. The objective of the DRINK trial is to answer the key design and feasibility questions required to deliver a successful definitive water intake trial. METHODS AND ANALYSIS: We describe the design of a single-centre, open-label, prospective, randomised controlled trial. The ""Determining feasibility of R andomisation to high vs. ad libitum water In take in Polycystic K idney Disease"" (DRINK) trial aims to enrol 50 patients with ADPKD, over the age of 16 years with an estimated glomerular filtration rate (eGFR) >=20 mL/min/1.73 m2. Participants will be randomised 1:1 to HW intake based on an individualised water intake prescription, or to ad libitum (AW) water intake. The HW group will aim for a dilute urine (urine osmolality <=270 mOsm/kg) as a surrogate marker of vasopressin suppression, and those in the AW group will target more concentrated urine. Participants will have an 8-week treatment period, and will be seen at weeks 0, 2, 4 and 8, undergoing assessments of fluid status, renal function and serum and urine osmolalities. They will receive dietary advice, and self-monitor urine specific gravity and fluid intake. The trial employs smartphone technology to permit home monitoring and remote direct data capture. The primary feasibility end points are recruitment rate and separation between arms in measured urinary osmolality. Key secondary assessments include acceptability, adherence, health-related quality of life, acute effects of HW intake on measured (51Cr-EDTA) and eGFR and ADPKD-related pain. ETHICS AND DISSEMINATION: Ethical approval was awarded by the East of England Essex Research Ethics Committee (16/EE/0026). The results of DRINK will be submitted to peer-reviewed journals, and presented to patients via the PKD Charity. TRIAL REGISTRATION NUMBER: NCT02933268 and ISCRTN16794957."
28679364	Understanding barriers to medication, dietary, and lifestyle treatments prescribed in polycystic kidney disease.	BACKGROUND: Autosomal dominant polycystic kidney disease (PKD) is the most common genetic renal disease and the fourth leading cause of end-stage renal disease in the United States. Although there is no cure for PKD, several treatments are considered to be beneficial, including blood pressure control, exercise, low-salt diet, and high volume water intake. However, levels of understanding of the importance of these treatments and adherence to these recommendations vary among patients. This study explores illness perception models of patients with PKD to reveal barriers in adherence to prescribed therapies; satisfaction with medical care; and sources of medical information. METHODS: We designed a phenomenological interview study to evaluate illness perception models of individuals with PKD. Patients were identified from the national PKD Foundation e-mail distribution list (N = 190) and responded voluntarily to an introductory survey (N = 50). Seventeen PKD patients in the Bay Area were scheduled for one-on-one in-depth interviews with one trained interviewer (W-CT). Open-ended questions administered with an interview guide were used to evaluate patients' beliefs. RESULTS: Mean age was 56.6 +/- 12 years (range 29-78); 65% were female. Many of the PKD patients in this study were highly motivated and willing to incorporate blood pressure, exercise, low-salt diet, and high volume water intake into their daily routines. Barriers to adherence to these therapies include personal beliefs and confusion due to unclear recommendations. CONCLUSIONS: These findings suggest there is variability between what patients understand about their disease and treatments and what they believe their doctors have told them. Not all physicians focus on lifestyle-based treatments, but the majority of PKD patients in our study are motivated and willing to incorporate blood pressure control, exercise, low-salt diet, and high volume water intake into their daily routines and would like specific recommendations on how to implement these. These findings support a role for further exploring patient beliefs about the disease and its necessary treatments in order to design strategies to improve communication and meet the needs of these patients.
27993381	Dietary salt restriction is beneficial to the management of autosomal dominant polycystic kidney disease.	The CRISP study of polycystic kidney disease (PKD) found that urinary sodium excretion associated with the rate of total kidney volume increase. Whether sodium restriction slows the progression of Autosomal Dominant PKD (ADPKD) is not known. To evaluate this we conducted a post hoc analysis of the HALT-PKD clinical trials of renin-angiotensin blockade in patients with ADPKD. Linear mixed models examined whether dietary sodium affected rates of total kidney volume or change in estimated glomerular filtration rate (eGFR) in patients with an eGFR over 60 ml/min/1.73 m2 (Study A) or the risk for a composite endpoint of 50% reduction in eGFR, end-stage renal disease or death, or the rate of eGFR decline in patients with an eGFR 25-60 ml/min/1.73 m2 (Study B) all in patients initiated on an under100 mEq sodium diet. During the trial urinary sodium excretion significantly declined by an average of 0.25 and 0.41 mEq/24 hour per month in studies A and B, respectively. In Study A, averaged and time varying urinary sodium excretions were significantly associated with kidney growth (0.43%/year and 0.09%/year, respectively, for each 18 mEq urinary sodium excretion). Averaged urinary sodium excretion was not significantly associated with faster eGFR decline (-0.07 ml/min/1.73m2/year for each 18 mEq urinary sodium excretion). In Study B, the averaged but not time-varying urinary sodium excretion significantly associated with increased risk for the composite endpoint (hazard ratio 1.08 for each 18 mEq urinary sodium excretion) and a significantly faster eGFR decline (-0.09 ml/min/1.73m2/year for each mEq 18 mEq urinary sodium excretion). Thus, sodium restriction is beneficial in the management of ADPKD.
31752750	Idiosyncratic hepatic toxicity in autosomal dominant polycystic kidney disease (ADPKD) patient in combined treatment with tolvaptan and amoxicillin/clavulanic acid: a case report.	BACKGROUND: Autosomal dominant polycystic kidney disease (ADPKD) is a hereditary disease characterized by the presence of renal cysts. Over time the expanding cysts lead to progressive renal failure. The use of tolvaptan, a V2-receptor antagonist, was recently approved in ADPKD patients. It was demonstrated that tolvaptan get slower decline in Kidney function compared with placebo. Idiosyncratic hepatic toxicity was described in patients receiving tolvaptan, with elevations in aminotransferases levels. We describe the first case reported in the literature in which hepatic toxicity is caused by the association of amoxicillin/clavulanic acid and tolvaptan. CASE PRESENTATION: A 41 years old woman with diagnosis of ADPKD had been in treatment with tolvaptan for 16 weeks when an elevation of liver enzyme levels was detected. She had taken autonomously amoxicillin/clavulanic acid (in doses of 825/175 mg twice a day for 7 days) about 5 weeks before. The timing of the event and the kind of hepatocellular injury could be attributed to the concomitance of medication of tolvaptan and amoxicillin/clavulanic acid. CONCLUSION: We highlight the need to careful monitor hepatic enzyme levels in order to recognize early hepatic side effects in ADPKD patients in treatment with tolvaptan and amoxicillin/clavulanic acid.
28024168	Carbohydrate antigen 19-9 is significantly elevated in autosomal dominant polycystic kidney disease.	AIM: Liver cysts are the most common extrarenal manifestation in patients with autosomal dominant polycystic kidney disease (ADPKD). Carbohydrate antigen 19-9 (CA19-9) is generally used as a marker for biliopancreatic malignancies, although CA19-9 levels in patients with ADPKD are largely unknown. METHODS: A prospective observational study of 53 ADPKD patients and 83 non-ADPKD control subjects was performed. The serum levels of CA19-9 were studied to evaluate the association with clinical parameters and liver cysts. RESULTS: The serum CA19-9 levels were significantly higher in the ADPKD group than in the control group (32.9 U/mL vs. 9.8 U/mL, respectively, P < 0.001). The serum CA19-9 levels in the ADPKD group were positively correlated with the mean blood pressure (rho = 0.335, P < 0.05), gamma-glutamyl transferase (GTP) levels (rho = 0.541, P < 0.001), the largest cyst size (rho = 0.536, P < 0.001) and the liver cyst volume (rho = 0.682, P < 0.001). Multiple regression analyses showed that the gamma-GTP levels (P < 0.001) and the liver cyst volumes (P < 0.001) were independent predictors for serum CA19-9 levels. CONCLUSIONS: Serum CA19-9 levels are significantly elevated and appear to be dependent on the gamma-GTP levels and the volume of liver cysts in patients with ADPKD. Our findings indicate that the measurement of the baseline CA19-9 level in each patient with ADPKD may be useful for the interpretation of the value and the differential diagnosis of liver diseases, particularly the liver cyst infection.
37120342	A Case Report of Successful Kidney Transplantation in a Patient With Autosomal Dominant Polycystic Kidney Disease Who Underwent Thoracic Endovascular Aortic Repair for Type B Aortic Dissection.	BACKGROUND: Autosomal dominant polycystic kidney disease (ADPKD) is associated with several cardiovascular disorders, including aortic dissection, which preferentially occurs at the thoracic or abdominal level. Because there are few case reports describing surgical repair for aortic dissection followed by renal transplantation in patients with ADPKD, kidney transplantation performed after repair for aortic dissection remains challenging. CASE PRESENTATION: A 34-year-old Japanese man with end-stage renal disease secondary to ADPKD underwent thoracic endovascular aortic repair for complicated acute type B aortic dissection 12 months earlier. A contrast computed tomography scan before transplantation revealed an aortic dissection involving the descending aorta proximal to the common iliac arteries and confirmed multiple large bilateral renal cysts. After simultaneous right native nephrectomy, the patient underwent preemptive living-donor kidney transplantation obtained from his mother. Intraoperatively, we noted that dissection of the external iliac vessels was difficult because of dense adhesions. Arterial clamping was performed immediately below the bifurcation of the internal iliac artery to prevent further aortic dissection of the external iliac artery. After end-to-end anastomosis to the internal iliac artery was completed and the vascular clamp was released, the kidney began to produce urine immediately. CONCLUSION: This case suggests that kidney transplantation in patients undergoing endovascular aortic repair for aortic dissection can be performed by adequately applying a vascular clamp proximal to the internal iliac artery during vascular anastomosis.
29358433	Randomised controlled trial to determine the efficacy and safety of prescribed water intake to prevent kidney failure due to autosomal dominant polycystic kidney disease (PREVENT-ADPKD).	INTRODUCTION: Maintaining fluid intake sufficient to reduce arginine vasopressin (AVP) secretion has been hypothesised to slow kidney cyst growth in autosomal dominant polycystic kidney disease (ADPKD). However, evidence to support this as a clinical practice recommendation is of poor quality. The aim of the present study is to determine the long-term efficacy and safety of prescribed water intake to prevent the progression of height-adjusted total kidney volume (ht-TKV) in patients with chronic kidney disease (stages 1-3) due to ADPKD. METHODS AND ANALYSIS: A multicentre, prospective, parallel-group, open-label, randomised controlled trial will be conducted. Patients with ADPKD (n=180; age <=65 years, estimated glomerular filtration rate (eGFR) >=30 mL/min/1.73 m2) will be randomised (1:1) to either the control (standard treatment+usual fluid intake) or intervention (standard treatment+prescribed fluid intake) group. Participants in the intervention arm will be prescribed an individualised daily fluid intake to reduce urine osmolality to <=270 mOsmol/kg, and supported with structured clinic and telephonic dietetic review, self-monitoring of urine-specific gravity, short message service text reminders and internet-based tools. All participants will have 6-monthly follow-up visits, and ht-TKV will be measured by MRI at 0, 18 and 36 months. The primary end point is the annual rate of change in ht-TKV as determined by serial renal MRI in control vs intervention groups, from baseline to 3 years. The secondary end points are differences between the two groups in systemic AVP activity, renal disease (eGFR, blood pressure, renal pain), patient adherence, acceptability and safety. ETHICS AND DISSEMINATION: The trial was approved by the Human Research Ethics Committee, Western Sydney Local Health District. The results will inform clinicians, patients and policy-makers regarding the long-term safety, efficacy and feasibility of prescribed fluid intake as an approach to reduce kidney cyst growth in patients with ADPKD. TRIAL REGISTRATION NUMBER: ANZCTR12614001216606.
