33061070	Association|MONDO:0007947|ncbi2200	Aortic root surgery in MONDO:0007947.MONDO:0007947 (MONDO:0007947) is an MONDO:0003900 etiologically related with ncbi2200 gene mutation. The altered microfibril protein structure result in characteristic HP:0001626 including diseaseD000094628, diseaseD000094628, and HP:0005294. diseaseD000094628 and subsequent dissection are the major causes of reduced life expectancy in MONDO:0007947 9606. Prophylactic aortic root replacement has improved the survival of 9606 with MONDO:0007947. Elective root replacement carries very low mortality and morbidity. Emergency root replacement for dissection is accompanied with higher early mortality and late diseaseD003643/interventions. Both the techniques of aortic root replacement, total root replacement (TRR) with a prosthetic valved conduit, and valve-sparing root replacement (VSRR) yield excellent early and late results. Considering the low risk of prosthetic valve-related events, the improved long-term survival, and event-free survival, TRR continues to be a very effective surgical option. VSSR also seems to be a good option for the first 10 to 15 years following surgery in MONDO:0007947 9606. The choice of procedure depends upon available expertise, 9606' choice, feasibility of anticoagulation, possibility of pregnancy, and lifestyle of the 9606. Aortic root morphology and state of valve cusps also affect the decision making. In recent times, personalized external aortic root support (PEARS) with a macroporous mesh sleeve has also emerged as a promising alternative to aortic root replacement. All these 9606 need close monitoring for whole life after surgical intervention.
23624982	Negative_Correlation|chemicalD011093|MONDO:0007947	External aortic root support: a histological and mechanical study in 9940.OBJECTIVES: Personalized external aortic root support has completed initial evaluation and has technology appraisal in the UK for 9606 with MONDO:0007947 for use as an alternative to root replacement. Its long-term success in preventing HP:0005294 remains uncertain. Here, we report a study in 9940 to establish whether the externally supporting mesh, as used clinically, is biologically incorporated. The strength of the resulting mesh/artery composite has been tested. METHODS: The carotid artery of growing 9940 (n=6) was enclosed in a mesh sleeve made of a chemicalD011108, chemicalD011093. After a predefined interval of 4-6 months, a length of the artery was excised, including the sleeved and unsleeved portions, and was stress tested and examined histologically. RESULTS: One animal died of MONDO:0005249 7 days after implantation. Comparing sleeved with normal segments, the overall thickness was increased and there was a fibrotic sheet in the periarterial space. The overall vessel wall architecture was preserved in all specimens. Although media thickness of ensleeved arteries was smaller and in one animal mild diseaseC536897 was found in one quadrant of the outer part of the media. There was a significant increase in stiffness and maximum tensile strength of the supported segments compared with normal arterial tissue. CONCLUSIONS: chemicalD011093 mesh, as used for the external support of the dilated aortic root in MONDO:0007947, becomes incorporated in the periadventitial tissue of the carotid artery of 9940. Limited thinning of the media, without any signs of diseaseD007249 or medial diseaseD009336, was visible. There was a significantly greater tensile strength in the carotid artery/mesh composite compared with the unsleeved carotid artery.
1922850	Negative_Correlation|chemicalD011126|HP:0000023; Negative_Correlation|chemicalD011093|HP:0000023	When to use mesh in HP:0000023 repair.With 9606 living longer today, averaging 73 years old, the type of 9606 with HP:0000023 are different than in the past. At the present time, to avoid the high incidence of recurrence due to the aged and weakened tissue component of the groin area, we reinforce the posterior wall of the inguinal canal with chemicalC025539 (chemicalD011093) mesh. Most surgeons agree to use a prosthetic mesh in recurrent HP:0000023 repairs. Moreover, sometimes it is necessary to use mesh in 9606 with connective tissue disorders like MONDO:0020066, MONDO:0007947, and acquired MONDO:0006652. Currently, chemicalD011126 and chemicalD011093 mesh are the most satisfactory, since they are readily available and become well incorporated by connective tissue.
20007995		Manufacturing and placing a bespoke support for the MONDO:0007947 aortic root: description of the method and technical results and status at one year for the first ten 9606.Fatal HP:0005294 commonly occurs in MONDO:0007947. Prevention currently relies on elective replacement of the aortic root. We are evaluating the placement of a manufactured, bespoke external support derived from a computer aided design in a prospective study. In the first ten 9606, measurements were made consistently of the ascending aorta at the level of closure of the aortic valve cusps from magnetic resonance imaging (MRI) studies taken preoperatively and at fixed intervals thereafter. Before and after images were presented for measurement amongst duplicate images of 37 unoperated MONDO:0007947 9606 to permit assessment of intra-observer measurement reproducibility. All images were presented in random sequence to a radiologist unaware of the research question. The largest difference between the preoperative measurement and that made at least one year after surgery was determined. All 9606 had surgery as planned without complications and were alive at one year. In eight of the ten 9606, the largest observed change was a marked reduction in aortic root diameter. The primary objective of this surgery was achieved in each case, reinforcing the ascending aorta whilst leaving the native aortic valve intact and conserving the blood/endothelium interface.
24391317		Personalized external aortic root support.
30165980		External Aortic Root Support to Prevent MONDO:0005021 in 9606 With MONDO:0007947.BACKGROUND: Personalized external aortic root support (PEARS) was introduced in 2004 for prevention of diseaseD000094628 in MONDO:0007947 9606. The individual's aortic root is replicated by 3-dimensional printing. A chemicalD011108 mesh sleeve is manufactured, which is implanted with the aim to support and stabilize the aortic wall. OBJECTIVES: The aim of this study was to assess effectiveness of PEARS for prevention of diseaseD000094628 in MONDO:0007947 9606. METHODS: A total of 24 consecutive MONDO:0007947 9606 operated 2004 to 2012 were prospectively monitored with magnetic resonance imaging. Following a pre-defined protocol, baseline and follow-up aorta measurements were made in a blinded random sequence. RESULTS: The mean age of the 9606 was 33 +- 13.3 years (range: 16 to 58 years), and the mean aortic root diameter was 45 +- 2.8 mm (range: 41 to 52 mm). Follow-up was 6.3 +- 2.6 years. There was no increase in the aortic root and ascending aorta diameters, but there was a tendency toward reduction: annulus diameter 28.9 +- 2.3 mm to 28.5 +- 2.4 mm (change -0.39 mm, 95% confidence interval [CI]: -1.05 to 0.27 mm), sinus of Valsalva diameter 44.9 +- 2.9 mm to 44.5 +- 3.0 mm (change -0.37 mm, 95% CI: -1.23 to 0.51 mm), and ascending aorta diameter 32.4 +- 3.6 mm to 32.3 +- 3.7 mm (change -0.10 mm, 95% CI: -0.92 to 0.74 mm). In the same period, the descending aorta diameter increased from 22.9 +- 2.4 mm to 24.2 +- 3.0 mm (change 1.32 mm, 95% CI: 0.70 to 1.94 mm; p < 0.001) with a tendency toward increase in aortic arch diameter 24.1 +- 2.0 mm to 24.5 +- 2.8 mm (change 0.41 mm, 95% CI: -0.56 to 1.37 mm). CONCLUSIONS: PEARS is effective in stabilizing the aortic root and preventing its dilatation. It is a viable alternative for prevention of diseaseD000094630 in MONDO:0007947 9606.
