28495941		Pontomesencephalic Atrophy and Postural Instability in Wilson Disease.BACKGROUND AND PURPOSE: The MR Parkinsonism index helps in differentiating progressive supranuclear palsy from Parkinson disease and multisystem atrophy. Pontomesencephalic involvement is common in neurologic Wilson disease, but there is no prior study evaluating the MR Parkinsonism index and its indices in Wilson disease. We report the MR Parkinsonism index and its indices in Wilson disease and correlate these changes with clinical severity and postural reflex. MATERIALS AND METHODS: Thirteen individuals with neurologic Wilson disease were included, and their clinical details, including neurologic severity, postural reflex abnormality, and location of signal changes on MR imaging, were noted. The 3D BRAVO T1 sequence was used for measurement of the MR Parkinsonism index and its indices. The MR Parkinsonism index and its indices were also obtained in 6 age- and sex-matched controls. The morphometric parameters in Wilson disease were compared with those in with healthy controls and among the patients with and without abnormal postural reflex. RESULTS: The midbrain area was reduced in patients with Wilson disease compared with controls (112.08 +- 27.94 versus 171.95 +- 23.66 mm2, P = .002). The patients with an abnormal postural reflex had an increased MR Parkinsonism index and pons-to-midbrain ratio compared with controls, whereas these parameters were equivalent in patients with normal postural reflex and controls. The patients with abnormal postural reflex had more severe illness, evidenced by higher Burke-Fahn-Marsden scores (51.0 +- 32.27 versus 13.75 +- 12.37, P = .04) and neurologic severity grades (2.57 +- 0.53 versus 1.67 +- 0.82, P = .04). CONCLUSIONS: An increase in the MR Parkinsonism index in Wilson disease is mainly due to midbrain atrophy and it correlates with neurologic severity and abnormal postural reflex.
36422847		Plugged percutaneous liver biopsy using Tru-cut needle and coils: A retrospective study.BACKGROUND: Plugged percutaneous liver biopsy, though has been in use for many years, is being used more frequently in patients in whom percutaneous liver biopsy is contraindicated due to proven or probable bleeding tendencies. We report our experience with this procedure, its indications, efficacy, and complications in Indian population over 2 years. METHODS: A retrospective study of 127 consecutive patients who had undergone plug liver biopsy from April 2017 to May 2019 was done from the database maintained in our department. The indications, technical success, complications, and impact of histological diagnosis on the management of those patients were evaluated. RESULTS: A total of 127 biopsies were performed of which 68 were males and 59 were females, aged between 7 and 73 years. No procedures were abandoned; however, 13 cases needed ultrasonography (USG) guidance because of small size of the liver or presence of right perihepatic fluid. Out of 127 biopsies, none of the samples was inadequate and yielded adequate tissue for histopathological diagnosis. Seven patients required repeat study only because underlying liver disease was suspected clinically and the previous biopsy report had turned out to be normal. Histopathological examination in our study showed autoimmune hepatitis in 61, cirrhotic changes either hepatitis B virus (HBV) or hepatitis C virus (HCV) related in 40, veno-occlusive disease in 3, cholestatic disease in 2, and Wilson's disease in 2 patients. The remaining 19 were normal. Complications occurred in 3 patients - arterioportal fistula, pneumothorax, and inadequate coiling causing mild hemoperitoneum. CONCLUSION: Percutaneous liver biopsy followed by plugging of the tract with coils is a safe, easy, and effective method in patients with underlying bleeding tendencies, minimal ascites, and small liver.
29325220	cause|@CHEMICAL_Bile_Pigments|@DISEASE_Kidney_Tubular_Necrosis_Acute ;cause|@CHEMICAL_Bilirubin|@DISEASE_Acute_Kidney_Injury	Profile, risk factors and outcome of acute kidney injury in paediatric acute-on-chronic liver failure.BACKGROUND & AIMS: There are no studies on acute kidney injury in paediatric acute-on-chronic liver failure. This study was planned with aim to describe the clinical presentation and outcome of acute kidney injury among paediatric acute-on-chronic liver failure patients. METHODS: Data of all children 1-18 years of age presenting with acute chronic liver failure (Asia pacific association for the study of the liver definition) was reviewed. Acute kidney injury was defined as per Kidney Diseases-Improving Global Outcomes guidelines. Poor outcome was defined as death or need for liver transplant within 3 months of development of acute kidney injury. RESULTS: A total of 84 children with acute-on-chronic liver failure were presented to us in the study period. Acute kidney injury developed in 22.6% of patients with acute-on-chronic liver failure. The median duration from acute-on-chronic liver failure to development of acute kidney injury was 4 weeks (Range: 2-10 weeks). The causes of acute kidney injury were hepatorenal syndrome (31.6%), sepsis (31.6%), nephrotoxic drugs (21%), dehydration (10.5%) and bile pigment related acute tubular necrosis in one patient. On univariate analysis, higher baseline bilirubin, higher international normalized ratio, higher paediatric end stage liver disease, presence of systemic inflammatory response syndrome and presence of spontaneous bacterial peritonitis had significant association with presence of acute kidney injury. On logistic regression analysis, presence of systemic inflammatory response syndrome (adjusted OR: 8.659, 95% CI: 2.18-34.37, P = .002) and higher baseline bilirubin (adjusted OR: 1.07, 95% CI: 1.008-1.135, P = .025) were independently associated with presence of acute kidney injury. Of the patients with acute kidney injury, 5(26.3%) survived with native liver, 10(52.6%) died and 4 (21.1%) underwent liver transplantation. CONCLUSION: Acute kidney injury developed in 22.6% of children with acute-on-chronic liver failure. Bilirubin more than 17.7 mg/dL and presence of systemic inflammatory response syndrome were high risk factors for acute kidney injury. Development of acute kidney injury in a child with acute-on-chronic liver failure suggests poor outcome and need for early intervention.
31276461		Scheimpflug Imaging of the Danish Cohort of Patients With Wilson Disease.PURPOSE: The purpose of this study was to investigate the use of anterior segment imaging in diagnosing Kayser-Fleischer rings in patients with Wilson disease. METHODS: In a tertiary center for Wilson disease, patients were examined with a Pentacam HR Scheimpflug-based tomography device in addition to conventional slit-lamp examination. The inferior part of the cornea was analyzed using both a built-in densitometry module and ImageJ. RESULTS: Thirty-one patients with Wilson disease (78% of all Danish patients) were included, resulting in 83 examinations over a 5-year period. Ten had a manifest Kayser-Fleischer ring in the inferior part of the cornea on at least 1 examination, 5 had other causes of peripheral corneal scatter, and 16 had normal examinations. The built-in densitometry module performed poorly in discriminating between the presence and absence of a Kayser-Fleischer ring. However, analysis of the images in ImageJ and calculation of a normalized signal (peak posterior value/peak anterior value) with a cutoff value set to 1 detected 28 of 31 Kayser-Fleischer rings and resulted in 96% sensitivity and 95% specificity. In 12 patients who underwent 3 or more examinations during the period, changes in the normalized signal seemed to reflect the efficiency of the treatment, although more studies are needed for this conclusion. CONCLUSIONS: ImageJ-based analysis of Pentacam images has a high sensitivity in detecting Kayser-Fleischer rings and can be used as a diagnostic procedure for Wilson disease and may be a tool to monitor the disease in an objective manner.
28284465	associate|@CHEMICAL_Ammonia|@DISEASE_Liver_Failure ;associate|@CHEMICAL_Manganese|@DISEASE_Liver_Failure ;cause|@CHEMICAL_Manganese|@DISEASE_Brain_Damage_Chronic ;cause|@CHEMICAL_Ammonia|@DISEASE_Brain_Damage_Chronic	Neurological disorders in liver transplant candidates: Pathophysiology and clinical assessment.Compromised liver function, as a consequence of acute liver insufficiency or severe chronic liver disease may be associated with various neurological syndromes, which involve both central and peripheral nervous system. Acute and severe hyperammoniemia inducing cellular metabolic alterations, prolonged state of "neuroinflammation", activation of brain microglia, accumulation of manganese and ammonia, and systemic inflammation are the main causative factors of brain damage in liver failure. The most widely recognized neurological complications of serious hepatocellular failure include hepatic encephalopathy, diffuse cerebral edema, Wilson disease, hepatic myelopathy, acquired hepatocerebral degeneration, cirrhosis-related Parkinsonism and osmotic demyelination syndrome. Neurological disorders affecting liver transplant candidates while in the waiting list may not only significantly influence preoperative morbidity and even mortality, but also represent important predictive factors for post-transplant neurological manifestations. Careful pre-transplant neurological evaluation is essential to define severity and distribution of the neurological impairment, to identify the abnormalities still responsive to current treatment, and to potentially predict the inherent post-operative prognosis. The preferred specific indices of neurological pre-transplant assessment may vary among centers, however, even with the aid of the current biochemical, neurophysiological, neuropsychological and neuroimaging diagnostic tools, the correct diagnosis and differential diagnosis of various syndromes may be difficult. In this article the relevant pathophysiological and clinical aspects of the most frequent brain and peripheral nervous system diseases affecting liver transplant candidates with acute or advanced chronic liver failure are briefly reported. The practical diagnostic findings useful for the preoperative assessment and treatment, as well as the expected neurological evolution after liver transplantation are also evaluated.
33159804	associate|@CHEMICAL_Copper|@DISEASE_Hepatolenticular_Degeneration ;cause|@DISEASE_Neurologic_Manifestations|@VARIANT_p.L708P_ATP7B_human ;cause|@DISEASE_Chemical_and_Drug_Induced_Liver_Injury|@VARIANT_p.L708P_ATP7B_human ;associate|@DISEASE_Chemical_and_Drug_Induced_Liver_Injury|@GENE_ATP7B ;associate|@CHEMICAL_Copper|@DISEASE_Congenital_Hereditary_and_Neonatal_Diseases_and_Abnormalities ;associate|@CHEMICAL_Copper|@GENE_ATP7B ;associate|@DISEASE_Hepatolenticular_Degeneration|@GENE_ATP7B ;associate|@DISEASE_Neurologic_Manifestations|@GENE_ATP7B ;associate|@DISEASE_Neurologic_Manifestations|@GENE_ATP7B ;associate|@DISEASE_Chemical_and_Drug_Induced_Liver_Injury|@GENE_ATP7B	Wilson disease: revision of diagnostic criteria in a clinical series with great genetic homogeneity.BACKGROUND: Wilson disease is an autosomal recessive disorder of copper metabolism caused by mutations in the ATP7B gene. An early diagnosis is crucial to prevent evolution of the disease, as implantation of early therapeutic measures fully prevents its symptoms. As population genetics data predict a higher than initially expected prevalence, it was important to define the basic diagnostic tools to approach population screening. METHODS: A highly genetically homogeneous cohort of 70 patients, belonging to 50 unrelated families, has been selected as a framework to analyze all their clinical, biochemical and genetic characteristics, to define the disease in our population, with an estimated prevalence of 1 in 12,369, and determine the most useful features that reach diagnostic value. RESULTS: Serum ceruloplasmin below 11.5 mg/dL and cupremia below 60 mug/mL, were the best analytical predictors of the disease in asymptomatic individuals, while cupruria or hepatic copper determination were less powerful. Genetic analysis reached a conclusive diagnosis in all 65 patients available for complete testing. Of them, 48 were carriers of at least one p.Leu708Pro mutant allele, with 24 homozygotes. Nine patients carried a promoter deletion mutation, revealing that extended sequencing beyond the ATP7B gene-coding region is essential. All mutations caused hepatic damage since early ages, increasing its severity as diagnosis was delayed, and neurological symptoms appear. CONCLUSION: Serum ceruloplasmin determination followed by genetic screening would reduce costs and favor the prioritization of non-invasive procedures to reach a definitive diagnosis, even for asymptomatic cases.
28435998	cause|@DISEASE_Hepatolenticular_Degeneration|@VARIANT_p.R969Q_ATP7B_human ;associate|@DISEASE_Hepatolenticular_Degeneration|@GENE_ATP7B ;associate|@CHEMICAL_Copper|@DISEASE_Fibrosis ;associate|@DISEASE_Hepatolenticular_Degeneration|@GENE_ATP7B	A 6-year-old boy with Wilson disease-A diagnostic dilemma.A 6-year-old boy presented with 2 months history of progressive abdominal distension and jaundice. He was deeply icteric with ascites, hepatosplenomegaly, hyperbilirubinemia, raised transaminases, and coagulopathy. Viral markers and slit lamp examination for Kayser-Fleischer ring were negative. Serum ceruloplasmin and 24-h urinary copper post-D-pencillamine challenge were normal. Anti-smooth muscle antibody was positive 1:20, and liver biopsy showed micronodular cirrhosis with abundant Mallory hyaline and stainable copper deposits. The liver histology was indicative of Indian childhood cirrhosis, whereas the presence of autoantibodies, elevated transaminases, and increased globulin was suggestive of autoimmune hepatitis. Gene studies identified p.R969Q mutation in ATP7B gene, which solved the dilemma and confirmed the diagnosis of Wilson disease (WD). We report a clinicopathological conference of this boy to highlight the challenges faced by pediatricians in the diagnosis of Wilson disease.  .
38081365	negative_correlate|@CHEMICAL_Copper_64|@CHEMICAL_tetrathiomolybdate ;treat|@CHEMICAL_tetrathiomolybdate|@DISEASE_Hepatolenticular_Degeneration ;associate|@CHEMICAL_Copper|@DISEASE_Hepatolenticular_Degeneration ;negative_correlate|@CHEMICAL_tetrathiomolybdate|@CHEMICAL_Copper	Effects of tetrathiomolybdate on copper metabolism in healthy volunteers and in patients with Wilson disease.BACKGROUND & AIMS: In Wilson Disease (WD), copper accumulates in the liver and brain causing disease. Bis-choline tetrathiomolybdate (TTM) is a potent copper chelator that may be associated with a lower risk of inducing paradoxical neurological worsening than conventional therapy for neurologic WD. To better understand the mode of action of TTM, we investigated its effects on copper absorption and biliary excretion. METHODS: In a double-blind randomized setting, hepatic 64Cu activity was examined after orally administered 64Cu by PET/CT in 16 healthy volunteers before and after seven days of TTM treatment (15 mg/d) or placebo. Oral 64Cu was administered one hour after the final TTM dose. Changes in hepatic 64Cu activity reflected changes in intestinal 64Cu uptake. Additionally, in four patients with WD, the distribution of 64Cu in venous blood, liver, gallbladder, kidney, and brain was followed after i.v. 64Cu dosing for up to 68 hours before and after seven days of TTM (15 mg/day), using PET/MRI. Increased gallbladder 64Cu activity was taken as evidence of increased biliary 64Cu excretion. RESULTS: In healthy volunteers, TTM reduced intestinal 64Cu uptake by 82% 15 hours after the oral 64Cu dose. In patients with WD, gallbladder 64Cu activity was negligible before and after TTM, while TTM effectively retained 64Cu in the blood, significantly reduced hepatic 64Cu activity at all time-points and significantly reduced cerebral 64Cu activity two hours after the intravenous 64Cu dose. CONCLUSIONS: While we did not show an increase in biliary excretion of 64Cu following TTM administration, we demonstrated that TTM effectively inhibited most intestinal 64Cu uptake and retained 64Cu in the blood stream, limiting the exposure of 64Cu to organs like the liver and the brain. IMPACT AND IMPLICATIONS: Bis-choline tetrathiomolybdate (TTM) is an investigational copper chelator being developed for the treatment of Wilson disease. In animal models of Wilson disease, TTM has been shown to facilitate biliary copper excretion. In the present human study, TTM surprisingly did not facilitate biliary copper excretion but instead reduced intestinal copper uptake to a clinically significant degree. Our study builds on our understanding of human copper metabolism and the mechanism of action of TTM.
31899725		Management of Wilson Disease Diagnosed in Infancy: An Appraisal of Available Experience to Generate Discussion.Increased access to molecular genetic testing is changing the demographics for diagnosing inherited disorders and imposing new challenges for medical management. Wilson disease (WD), typically diagnosed in older children and adults, can now be detected in utero and in infants (children younger than 24 months, including neonates) via genetic testing. An evidence-based approach to management of these neonates and extremely young children, who are typically asymptomatic, has been hampered by lack of clinical experience. We present a case of an infantile diagnosis of WD, review available experience, and discuss current trends in antenatal genetic testing of parents and fetus that may lead to a very early diagnosis of WD. Based on physiological and nutritional considerations, we propose an algorithmic approach to management of infantile WD as a starting point for further discussion. Future collaboration amongst specialists is essential to identify evidence-based approaches and best practice for managing treatment of infants with genetically diagnosed WD.
31222986	treat|@CHEMICAL_Mycophenolic_Acid|@DISEASE_Anti_Neutrophil_Cytoplasmic_Antibody_Associated_Vasculitis ;cotreat|@CHEMICAL_Mycophenolic_Acid|@CHEMICAL_Penicillamine ;cause|@CHEMICAL_Penicillamine|@DISEASE_Rapidly_progressive_glomerulonephritis_with_pulmonary_hemorrhage ;compare|@CHEMICAL_Penicillamine|@CHEMICAL_Trientine ;treat|@CHEMICAL_Cyclophosphamide|@DISEASE_Hemoptysis ;treat|@CHEMICAL_Cyclophosphamide|@DISEASE_Hematuria ;cause|@CHEMICAL_Penicillamine|@DISEASE_Proteinuria ;cause|@CHEMICAL_Penicillamine|@DISEASE_Anti_Neutrophil_Cytoplasmic_Antibody_Associated_Vasculitis ;treat|@CHEMICAL_Mycophenolic_Acid|@DISEASE_Hematuria ;treat|@CHEMICAL_Cyclophosphamide|@DISEASE_Anti_Neutrophil_Cytoplasmic_Antibody_Associated_Vasculitis ;treat|@CHEMICAL_Penicillamine|@DISEASE_Hemoptysis ;treat|@CHEMICAL_Penicillamine|@DISEASE_Dyspnea ;treat|@CHEMICAL_Trientine|@DISEASE_Anti_Neutrophil_Cytoplasmic_Antibody_Associated_Vasculitis ;treat|@CHEMICAL_Cyclophosphamide|@DISEASE_Glycosuria_Renal ;treat|@CHEMICAL_Cyclophosphamide|@DISEASE_Dyspnea ;treat|@CHEMICAL_Mycophenolic_Acid|@DISEASE_Proteinuria ;cause|@CHEMICAL_Penicillamine|@DISEASE_Hemorrhage ;treat|@CHEMICAL_Penicillamine|@DISEASE_Hepatolenticular_Degeneration ;treat|@CHEMICAL_Mycophenolic_Acid|@DISEASE_Hemorrhage ;cause|@CHEMICAL_Penicillamine|@DISEASE_Glomerulonephritis ;cotreat|@CHEMICAL_Cyclophosphamide|@CHEMICAL_Penicillamine ;treat|@CHEMICAL_Cyclophosphamide|@DISEASE_Proteinuria ;treat|@CHEMICAL_Cyclophosphamide|@DISEASE_Hemorrhage ;cause|@CHEMICAL_Penicillamine|@DISEASE_Hematuria	A Pediatric Case of a D-Penicillamine Induced ANCA-associated Vasculitis Manifesting a Pulmonary-Renal Syndrome.D-penicillamine has been reported to cause antineutrophil cytoplasmic antibody (ANCA)-associated vasculitis presenting as rapidly progressive glomerulonephritis or pulmonary-renal syndrome mostly in adults. We report a pediatric case of D-penicillamine induced ANCA-associated vasculitis that manifests as a pulmonary-renal syndrome with a mild renal manifestation. A 13-year-old girl who has been taking D-penicillamine for five years under the diagnosis of Wilson disease visited the emergency room because of hemoptysis and dyspnea. She had diffuse pulmonary hemorrhage, microscopic hematuria, and proteinuria. Myeloperoxidase ANCA was positive, and a renal biopsy revealed pauci-immune crescentic glomerulonephritis. Under the diagnosis of D-penicillamine-induced ANCA-associated vasculitis, D-penicillamine was switched to trientine, and the patient was treated with plasmapheresis, glucocorticoid, cyclophosphamide, and mycophenolate mofetil. Pulmonary hemorrhage improved rapidly followed by the disappearance of the hematuria and proteinuria five months later.
37634880	cause|@DISEASE_Hepatolenticular_Degeneration|@VARIANT_p.V1262F_ATP7B_human ;cause|@DISEASE_Hepatolenticular_Degeneration|@VARIANT_p.V1262F_ATP7B_human ;cause|@DISEASE_Liver_Failure_Acute|@VARIANT_p.V1262F_ATP7B_human ;associate|@DISEASE_Liver_Failure_Acute|@GENE_ATP7B ;cause|@DISEASE_Liver_Failure_Acute|@VARIANT_p.V1262F_ATP7B_human ;cause|@DISEASE_Hepatolenticular_Degeneration|@VARIANT_p.V1262F_ATP7B_human ;cause|@DISEASE_Liver_Failure_Acute|@VARIANT_p.V1262F_ATP7B_human ;associate|@DISEASE_Hepatolenticular_Degeneration|@GENE_ATP7B	Severe Early-Onset Wilson Disease Caused by a Common Pathogenic Variant in the Bukharan Jewish Population in Israel.BACKGROUND: Wilson disease is caused by pathogenic variants in the ATP7B gene which encodes a copper-transporting ATPase. AIMS: Describe a common founder pathogenic variant among Bukharan Jews and to assess its prevalence, clinical features, and outcome. METHODS: The cohort consisted of patients of Bukharan Jewish descent diagnosed with Wilson disease at a tertiary pediatric medical center in 2013-2018. Clinical and genetic data were collected and analyzed. RESULTS: Six patients from 4 unrelated families who were homozygous for the c.3784G>T p.(Val1262Phe) pathogenic variant in ATP7B were identified. Five presented with elevated aminotransferase levels, and one, with acute liver failure. Mean age at diagnosis was 8.7 years (5-12.5). Serum ceruloplasmin level was extremely low in all patients (1.9-7 mg/dL; mean 3.2(. The variant was identified in a heterozygous state in 5/153 Bukharan Jews; 2/33 from our local exome database and 3/120 healthy unrelated Bukharan Jews in another cohort, for an estimated carrier frequency of ~1:30. CONCLUSIONS: We report a common founder pathogenic variant in the ATP7B gene among Bukharan Jews associated with severe early-onset Wilson disease. Given the clinical severity, high frequency of the variant, and being a treatable disease, its inclusion in pre-symptomatic screening in the Bukharan Jewish community should be considered. Furthermore, WD should be part of future genetic newborn screening programs in Israel and worldwide, to enable early treatment and prevention of future life-threatening complications.
37074913	associate|@CHEMICAL_Copper|@GENE_ATP7B ;associate|@CHEMICAL_Cisplatin|@GENE_ATP7B ;associate|@CHEMICAL_Copper|@DISEASE_Hepatolenticular_Degeneration ;associate|@CHEMICAL_Adenosine_Triphosphate|@CHEMICAL_Copper ;associate|@CHEMICAL_Adenosine_Triphosphate|@GENE_ATP7B ;associate|@DISEASE_Hepatolenticular_Degeneration|@GENE_ATP7B ;associate|@CHEMICAL_Copper|@CHEMICAL_Sulfur ;associate|@CHEMICAL_Copper|@GENE_MBD6 ;associate|@GENE_MBD6|@GENE_ATP7B	Structures of the human Wilson disease copper transporter ATP7B.The P-type ATPase ATP7B exports cytosolic copper and plays an essential role in the regulation of cellular copper homeostasis. Mutants of ATP7B cause Wilson disease (WD), an autosomal recessive disorder of copper metabolism. Here, we present cryoelectron microscopy (cryo-EM) structures of human ATP7B in the E1 state in the apo, the putative copper-bound, and the putative cisplatin-bound forms. In ATP7B, the N-terminal sixth metal-binding domain (MBD6) binds at the cytosolic copper entry site of the transmembrane domain (TMD), facilitating the delivery of copper from the MBD6 to the TMD. The sulfur-containing residues in the TMD of ATP7B mark the copper transport pathway. By comparing structures of the E1 state human ATP7B and E2-Pi state frog ATP7B, we propose the ATP-driving copper transport model of ATP7B. These structures not only advance our understanding of the mechanisms of ATP7B-mediated copper export but can also guide the development of therapeutics for the treatment of WD.
