32401363		Diagnostic Performance of Ultrasound Elastography and Serologic Fibrosis Indices for Evaluation of Hepatic Involvement in Wilson Disease.OBJECTIVES: To investigate the diagnostic value of transient elastography (TE), 2-dimensional (2D) shear wave elastography (SWE), and the serologic fibrosis indices aspartate transaminase-to-platelet ratio index (APRI) and Fibrosis-4 (FIB-4) score for Wilson disease (WD). METHODS: We retrospectively identified patients with a diagnosis of WD who underwent TE and 2D SWE on the same day. Their APRI and FIB-4 scores were calculated. Hepatic involvement was classified into 5 clinical categories (I-V) based on the laboratory findings, hepatic morphologic characteristics on ultrasound (US) imaging, and clinical symptoms of cirrhosis: I, normal (n = 17); II, only biochemical abnormality (n = 15); III, altered hepatic morphologic characteristics (n = 10); IV, compensated liver cirrhosis (n = 3); and V, decompensated liver cirrhosis (n = 0). We compared the area under the receiver operating characteristic curve (AUROC) data for TE, 2D SWE, the APRI, and the FIB-4 score. A combined assessment of the serologic markers and US elastography was performed, and the AUROCs of the combinations were compared. RESULTS: Forty-five patients were included in the study (median age, 16.0 years; range, 3-35 years). Transient elastography, 2D SWE, and APRI were comparable in distinguishing the clinical categories (AUROC, 0.799-0.928). The FIB-4 score showed lower diagnostic value in distinguishing clinical category I from the other categories (AUROC, 0.647). Combining the serologic markers and US elastography significantly increased the AUROC value of the FIB-4 score (with TE and 2D SWE, P = .01 and .02). CONCLUSIONS: Transient elastography and 2D SWE showed excellent diagnostic accuracy for differentiating the clinical categories of hepatic involvement. The APRI showed better diagnostic performance than the FIB-4 score. The assessment of hepatic manifestations in WD can be improved by combining US elastography with serologic indices.
33785637		Alternative Etiologies of Liver Disease in Children With Suspected NAFLD.OBJECTIVES: To determine the prevalence of alternative causes of liver disease in a cohort of youth with overweight and obesity undergoing evaluation for suspected nonalcoholic fatty liver disease (NAFLD). METHODS: Multicenter, retrospective cohort study of patients aged <=18 years with overweight and obesity and evidence of elevated serum aminotransferases and/or hepatic steatosis on imaging, referred for suspected NAFLD to Cincinnati Children's Hospital Medical Center (2009-2017) or Yale New Haven Children's Hospital (2012-2017). Testing was performed to exclude the following: autoimmune hepatitis (AIH), Wilson disease, viral hepatitis (B and C), thyroid dysfunction, celiac disease, alpha-1 antitrypsin deficiency, and hemochromatosis. RESULTS: A total of 900 children with overweight and obesity (63% boys, 26% Hispanic ethnicity) were referred, with a median age of 13 years (range: 2-18). Most had severe obesity (n = 666; 76%) with a median BMI z score of 2.45 (interquartile range [IQR]: 2.2-2.7). Median alanine aminotransferase level at presentation was 64 U/L (IQR: 42-95). A clinically indicated liver biopsy was performed in 358 children (40%) at a median of 6 months (IQR: 1-14) post initial visit; of those, 46% had confirmed nonalcoholic steatohepatitis. Positive autoantibodies were observed in 13% of the cohort, but none met criteria for AIH. Only 19 (2%) were found to have other causes of liver disease, with no cases of viral hepatitis or Wilson disease detected. CONCLUSIONS: In a large, multicenter cohort, the vast majority of children with overweight and obesity with presumed or confirmed NAFLD tested negative for other causes of liver disease. In contrast to a previous pediatric report, no patient was diagnosed with AIH.
34435331	associate|@CHEMICAL_Glutamic_Acid|@DISEASE_Neurobehavioral_Manifestations ;cause|@CHEMICAL_Glutamic_Acid|@DISEASE_Hepatolenticular_Degeneration	Neuropsychiatric Manifestations of Wilson Disease: Correlation with MRI and Glutamate Excitotoxicity.This study aims to identify neuropsychiatric manifestations in neurological Wilson disease (NWD), and their correlation with MRI changes and glutamate excitotoxicity. Forty-three consecutive patients with NWD from a tertiary care teaching hospital were evaluated prospectively who fulfilled the inclusion criteria. The neuropsychiatric evaluation was done using Neuropsychiatric Inventory (NPI) battery that assesses 12 domains including delusion, hallucination, agitation/aggression, dysphoria/depression, anxiety, euphoria, apathy, disinhibition, irritability, aberrant motor activity, appetite change, and abnormal nighttime behavior. Cranial MRI was done using a 3 T machine, and locations of signal changes were noted including the total number of MRI lesions. Serum glutamate level was measured by a fluorescence microplate reader. Abnormal NPI in various domains and total NPI scores were correlated with MRI lesions, serum and urinary copper, and glutamate level. The median age of the patients was 16 years. Forty-one (48.8%) patients had cognitive impairment and 37 (86%) had movement disorder. Neurobehavioral abnormality was detected in all-commonest being agitation (90.7%) followed by appetite change (81.4%), elation (74.4%), irritability (69.8%), anxiety (67.4%), depression (65.1%), apathy (44.2%), night time abnormal behavior (32.6%), aberrant motor behavior (20.9%), delusions (16.3%), and hallucination (18.6%). The thalamic lesion was associated with depression, globus pallidus with depression and anxiety, caudate with anxiety and agitation, brainstem with irritability, and frontal cortex with apathy. Serum glutamate level was higher in NWD. NPI sum score correlated with MRI load and glutamate level. Varying severity of neurobehavioral abnormalities are common in the patients with NWD and correlate with the location of MRI lesion and glutamate level.
32544364	treat|@CHEMICAL_Trientine|@DISEASE_Obesity ;treat|@CHEMICAL_Trientine|@DISEASE_Weight_Gain ;treat|@CHEMICAL_Spermidine|@DISEASE_Obesity ;treat|@CHEMICAL_Polyamines|@DISEASE_Obesity ;associate|@CHEMICAL_Trientine|@GENE_SAT1 ;treat|@CHEMICAL_Trientine|@DISEASE_Hepatolenticular_Degeneration	Triethylenetetramine (trientine): a caloric restriction mimetic with a new mode of action.Caloric restriction mimetics (CRMs) are nontoxic macroautophagy/autophagy enhancers that act through the stimulation of cytoplasmic protein deacetylation reactions. Thus far, three functional classes of CRMs have been described: inhibitors of acetyltransferases (such as spermidine), inhibitors of acetyl coenzyme (AcCoA) synthesis (such as hydroxycitrate) and activators of deacetylases/sirtuins (such as resveratrol). Triethylenetetramine (also called trientine, abbreviated TETA) is a synthetic polyamine with resemblance in its structure to spermidine, a natural polyamine reputed for its pro-autophagic, anti-obesity and anti-aging effects. TETA, which is approved for the treatment of Wilson disease, has no effects on the longevity of mice, yet does induce autophagy and reduces weight gain in mice fed a high-fat diet (HFD). Mechanistically, these effects of TETA involve an increased activity of the TETA-metabolizing enzyme, SAT1 (spermidine/spermine N1-acetyltransferase 1). SAT1 overactivation ultimately results in the depletion of intracellular AcCoA with a consequent de-acetylation of cytoplasmic proteins and induction of autophagy. Accordingly, TETA fails to induce autophagy or to control HFD-induced weight gain in SAT1-deficient mice. Altogether, these findings indicate that TETA induces autophagy through a novel mode of action, namely, by the activation of an AcCoA-depleting enzyme.
34908013		Re-evaluation of King Wilson Index in Children With Acutely Decompensated Hepatic Wilson Disease.OBJECTIVES: Liver transplantation (LT) in Wilson disease (WD) is a life-saving option for patients presenting with liver failure and encephalopathy. Patients without encephalopathy can avoid LT and treated successfully with chelation therapy. It is essential to predict the risk of fatal outcomes where LT is required. We aim to critically analyse the validity of the WD Index prospectively from a cohort of WD patients managed at our institution. METHODS: WD Index and other clinical data from 2005 to 2018, recorded prospectively as part of clinical management, were analysed. RESULTS: Over 13-year period, 52 children with WD (29 boys) with median age at diagnosis of 11.69 (range 3.92-17.26) years were studied. Of these, 17 were diagnosed as part of family screening, 17 presented with abnormal liver enzyme, and 18 with acute hepatic decompensation (AHD) as per PALF definition. Patients presented with abnormal liver enzyme and in the pre-symptomatic group had WD Index <11, and none of them required LT. WD Index is still a good predictor for LT in WD patients with AHD, providing a sensitivity of 80%, specificity of 100%, positive-predictive, and negative-predictive value of 100% and 80%, respectively. Patients presented with an index of 8-10 also required LT at median duration of 58 days (IQR 48-135 days). CONCLUSIONS: WD patients presenting with AHD who had an index of >=11 do require LT. Children with a WD Index of 8 to 10 within the first 2 months of admission require close monitoring as LT may become necessary.
35255304	associate|@DISEASE_Depressive_Disorder_Major|@GENE_GFAP ;associate|@DISEASE_Autism_Spectrum_Disorder|@GENE_GFAP ;associate|@DISEASE_Neuromyelitis_Optica|@GENE_GFAP ;associate|@DISEASE_Asthma|@GENE_GFAP ;associate|@DISEASE_COVID_19|@GENE_GFAP ;associate|@DISEASE_Diabetic_Ketoacidosis|@GENE_GFAP ;associate|@DISEASE_Alzheimer_Disease|@GENE_GFAP ;associate|@DISEASE_Frontotemporal_Lobar_Degeneration|@GENE_GFAP ;associate|@DISEASE_Glioblastoma|@GENE_GFAP ;associate|@DISEASE_Stroke|@GENE_GFAP ;associate|@DISEASE_Neurodegenerative_Diseases|@GENE_GFAP ;associate|@DISEASE_Hepatolenticular_Degeneration|@GENE_GFAP ;associate|@DISEASE_Parkinson_Disease|@GENE_GFAP ;associate|@DISEASE_Spinal_Cord_Injuries|@GENE_GFAP ;associate|@DISEASE_Epilepsy|@GENE_GFAP ;associate|@DISEASE_Friedreich_Ataxia|@GENE_GFAP ;associate|@DISEASE_Schizophrenia|@GENE_GFAP ;associate|@DISEASE_Heredodegenerative_Disorders_Nervous_System|@GENE_GFAP ;associate|@DISEASE_Multiple_Sclerosis|@GENE_GFAP ;associate|@DISEASE_Neurologic_Manifestations|@GENE_GFAP	Serum glial fibrillary acidic protein is a body fluid biomarker: A valuable prognostic for neurological disease - A systematic review.Astrocytes are the most abundant cell type in the human central nervous system, and they play an important role in the regulation of neuronal physiology. In neurological disorders, astrocyte disintegration leads to the release of glial fibrillary acidic protein (GFAP) from tissue into the bloodstream. Elevated serum levels of GFAP can serve as blood biomarkers, and a useful prognostic tool to facilitate the early diagnosis of several neurological diseases ranging from stroke to neurodegenerative disorders. This systematic review synthesizes studies published between January 2012 and September 2021 that used GFAP as a potential blood biomarker to detect neurological disorders. The following electronic databases were accessed: MEDLINE, Scopus, and Web of Science. In all the databases, the following search strategy was used:  GFAP  OR  glial fibrillary acidic protein  AND  neurological  OR  neurodegenerative  AND  plasma  OR  serum . The initial search identified 1152 articles. After the exclusion criteria were applied, 48 publications that reported GFAP levels in neurological disorders were identified. A total of16 different neurological disorders that have plasmatic GFAP levels as a possible biomarker for the disease were described in the articles, being: multiple sclerosis, frontotemporal lobar degeneration, Alzheimer's disease, Parkinson disease, COVID-19, epileptic seizures, Wilson Disease, diabetic ketoacidosis, schizophrenia, autism spectrum disorders, major depressive disorder, glioblastoma, spinal cord injury, asthma, neuromyelitis optica spectrum disorder and Friedreich's ataxia. Our review shows an association between GFAP levels and the disease being studied, suggesting that elevated GFAP levels are a potentially valuable diagnostic biomarker in the evaluation of different neurological diseases.
37347440		Pediatric Acute-on-Chronic Liver Failure.Acute-on-chronic liver failure (ACLF) is characterized by an acute hepatic insult happening in a patient with underlying cirrhosis with compromised hepatic reserve leading to development of systemic inflammation, sepsis, and organ failure resulting in poor outcome in majority. While Asia Pacific Association for Study of Liver Diseases (APASL) emphasizes on early diagnosis before development of organ failure, European Association for Study of Liver Diseases (EASL) mandates the presence of organ failures to define ACLF. There is a lack of consensus definition of pediatric ACLF although recent APASL guidelines have tried to address the issue. While Wilson disease (WD) and autoimmune hepatitis (AIH) are the most common cause of underlying cirrhosis in children, acute viral hepatitis and flares of WD and AIH are the commonest acute precipitating events. Poor outcomes [death and liver transplantation (LT)] ranging from 19 to 59% have been reported. Prognosis in pediatric ACLF is usually better than that in adults due to greater proportion of treatable etiologies, lesser organ failures, comorbidities and better hepatic reserves. APASL ACLF Research Consortium (AARC) score more than or equal to 11 is predictive of poor 28-90 d mortality. Treatment of pediatric ACLF relies mainly on prompt diagnosis and medical management of a potentially treatable etiology of underlying cirrhosis. Bridging therapies, especially high volume plasma exchange can be initiated early as a bridge to LT or native liver recovery. Those with no improvement in 4-7 d should undergo LT before development of sepsis or multi-organ failure.
32726213		A Rare Constrictive Pericarditis with Complete Separation between the Visceral and Parietal Pericardium: A Case Report.BACKGROUND: Pericarditis is the most common form of pericardial disease, while constrictive pericarditis is challenging in diagnosis and is easily overlooked. CASE REPORT: A 30-year-old female presented with abdominal distension and mild lower extremity edema for 3 months. The patient was initially suspected of having cirrhosis caused by Wilson Disease. Following liver biopsy and multiple investigation, thickened, calcified pericardium was detected by echocardiography and chest computed tomography. The patient was finally diagnosed with chronic constrictive pericarditis and received pericardiectomy. Intraoperatively, we found that the heart was entirely constricted by the thickened and calcified visceral pericardium, which was completely separated from the parietal pericardium. The patient received successful pericardiectomy and had relief of symptoms after surgery. CONCLUSION: Patients with constrictive pericarditis may present with symptoms similar to that of chronic liver diseases, which makes it difficult and complicated for diagnosis. This case highlights the importance of comprehensive preoperative evaluation and maintaining clinical suspicion of pericarditis in patients with features of elevated systemic venous pressure. In addition, constrictive pericarditis with complete separation between visceral and parietal pericardium has seldom been reported.
32398357		Liver transplantation as a rescue therapy for severe neurologic forms of Wilson disease.OBJECTIVE: To evaluate the effect of liver transplantation (LT) in patients with Wilson disease (WD) with severe neurologic worsening resistant to active chelation. METHODS: French patients with WD who underwent LT for pure neurologic indication were retrospectively studied. Before LT and at the last follow-up, neurologic impairment was evaluated with the Unified Wilson's Disease Rating Scale (UWDRS) score, disability with the modified Rankin Scale (mRS) score, and hepatic function with the Model for End-stage Liver Disease score, together with the presence of a Kayser-Fleischer ring (KFR), brain MRI scores, and copper balance. The survival rate and disability at the last follow-up were the coprimary outcomes; evolution of KFR and brain MRI were the secondary outcomes. Prognosis factors were further assessed. RESULTS: Eighteen patients had LT. All were highly dependent before LT (median mRS score 5). Neurologic symptoms were severe (median UWDRS score 105), dominated by dystonia and parkinsonism. The cumulated survival rate was 88.8% at 1 year and 72.2% at 3 and 5 years. At the last follow-up, 14 patients were alive. Their mRS and UWDRS scores improved (p < 0.0001 and p = 0.0003). Eight patients had a major improvement (78% decrease of the UWDRS score), 4 a moderate one (41% decrease), and 2 a stable status. KFR and brain MRI scores improved (p = 0.0007). Severe sepsis (p = 0.011) and intensive care unit admission (p = 0.001) before LT were significantly associated with death. CONCLUSIONS: LT is a rescue therapeutic option that should be carefully discussed in selected patients with neurologic WD resistant to anticopper therapies (chelators or zinc salts) as it might allow patients to gain physical independency with a reasonable risk. CLASSIFICATION OF EVIDENCE: This study provides Class IV evidence that for patients with WD with severe neurologic worsening resistant to active pharmacologic therapy, LT might decrease neurologic impairment.
37565896	associate|@DISEASE_Thrombosis|@GENE_SERPINE1	Acute mesenteric ischemia secondary to superior mesenteric vein thrombosis in a patient with liver cirrhosis: A case report.RATIONALE: Acute mesenteric ischemia due to superior mesenteric vein (SMV) thrombosis is a rare yet potentially life-threatening emergency. Our case report explores this condition in the context of a patient with liver cirrhosis due to Wilson disease. We specifically highlight the complex derangement of the coagulative balance in liver cirrhosis. PATIENT CONCERNS: A 34-year-old female with Wilson disease-related cirrhosis presented with intractable abdominal pain, nausea, and vomiting that showed no response to antispasmodic medication. DIAGNOSES: A contrast-enhanced abdominal computed tomography scan and Doppler ultrasound confirmed an intraluminal filling defect in the SMV, leading to the diagnosis of SMV thrombosis. INTERVENTIONS: Prompt anticoagulation, intravenous fluids, and an antibiotic were initiated. Surgical consultation recommended conservative therapy with close monitoring. OUTCOMES: Over the following 2 days, the patient's condition improved considerably, with almost complete resolution of her symptoms. Genetic testing identified a 4G/4G homozygous genotype of the plasminogen activator inhibitor 1 gene, associated with a higher risk of thrombosis in the vessels of internal organs. After 2 months of sustained anticoagulant therapy, a follow-up contrast-enhanced computed tomography scan revealed near-complete recanalization of the SMV, and the patient remained symptom-free. LESSONS: This case underscores the importance of early detection and treatment of acute mesenteric ischemia in patients with liver cirrhosis, as well as the potential role of genetic factors in thrombosis.
31653639	associate|@DISEASE_Hepatolenticular_Degeneration|@GENE_CP ;cause|@CHEMICAL_Alcohols|@DISEASE_Liver_Diseases ;cause|@CHEMICAL_Alcohols|@DISEASE_Acute_Kidney_Injury	Wilson disease: a diagnostic challenge in a patient with alcoholic liver disease.A 32-year-old man with alcoholic cirrhosis presented with worsening abdominal distension and jaundice. He was diagnosed with cirrhosis 2 years prior after a hospitalisation for acute liver failure, during which viral, autoimmune and metabolic workup was unrevealing. Heavy alcohol consumption was his only obvious risk factor for liver disease, so his decompensation was attributed to alcohol. At the present time, he was admitted with acute-on-chronic liver failure and acute renal failure. The severity of his presentation and the disproportionately mild elevation in alkaline phosphatase relative to his hyperbilirubinaemia prompted repeating a ceruloplasmin level, which, though previously normal, was now low, and eventually led to a diagnosis of Wilson disease (WD) with concomitant alcoholic liver disease. Clinicians must recognise limitations in ceruloplasmin and copper levels when screening for WD and maintain suspicion for WD in young patients, even if there is an already established aetiology of liver disease.
30861190	cause|@CHEMICAL_Penicillamine|@DISEASE_Hematuria ;cause|@CHEMICAL_Penicillamine|@DISEASE_Renal_Insufficiency ;cause|@CHEMICAL_Penicillamine|@DISEASE_Urofacial_syndrome ;cause|@CHEMICAL_Penicillamine|@DISEASE_Hypercalciuria ;treat|@CHEMICAL_Penicillamine|@DISEASE_Hepatolenticular_Degeneration	Urinary abnormalities in children and adolescents with Wilson disease before and during treatment with d-penicillamine.BACKGROUND AND AIM: Renal abnormalities can occur at any time point during the course of Wilson disease (WD). We aimed to fill a literature gap in this respect by studying urinary abnormalities in children and adolescents with WD. METHODS: This study included 60 children with WD presenting to the Pediatric Hepatology Unit, Cairo University. The following data were retrieved from the patients' files including age, sex, liver function tests, serum ceruloplasmin, 24-h urinary copper, serum creatinine, blood urea nitrogen, urinalysis, urinary albumin/creatinine ratio, urinary calcium/creatinine ratio, urinary beta2-microglobulin, liver and renal biopsy results when available. RESULTS: All studied cases had no symptoms related to renal involvement. Microscopic hematuria was detected in 11% and 12% at baseline and within 5 years of therapy, respectively. Moderate microalbuminuria was detected in 34%, 50%, and 33% at baseline, within 5 years and > 5 years after therapy, respectively. Hypercalciuria was detected in 23% at baseline, 34% in those patients treated for up to 5 years and 37.5% > 5 years of therapy. Age and international normalized ratio were significantly higher in patients with high calcium/creatinine ratio compared with those with normal values at initial evaluation. Frequency of elevated urinary beta2-microglobulin was 36%, 36%, and 37% in patients at baseline, up to 5 years and > 5 years of therapy, respectively. CONCLUSION: Asymptomatic urinary abnormalities are present in patients with WD at any time point of the disease and during treatment with d-penicillamine. They have to be searched for, as early intervention may prevent progression to renal insufficiency.
33316133		Neurodegeneration in Hepatic and Neurologic Wilson's Disease.Clinical presentation of Wilson disease (WD) includes hepatic and neurologic manifestations. This study compares subcortical brain regions by magnetic resonance imaging in patients with WD and without neurological symptoms. Distinct atrophy affecting the basal ganglia, accumbens, and hippocampus was present in neurological WD. Cerebellar atrophy was observed in hepatic WD without neurological symptoms.
30701819		The first experience of non-interferon therapy of HCV infection in patients with Wilson-Konovalov's disease.In the article we present three clinical observations demonstrating that HCV infection in patients with remission of Wilson disease causes an recrudescence of the disease, in one of the observations - decompensation of liver cirrhosis. In this study we first describe on the successful treatment of HCV infection with direct antiviral drugs in patients with Wilson disease. Establishment of all factors of liver damage and successful treatment (elimination of the virus, adequate lifelong medical treatment) allow to expect a favorable prognosis in patients with a combination of Wilson disease and HCV infection.
31474637	treat|@CHEMICAL_Zinc_Acetate|@DISEASE_Hepatolenticular_Degeneration ;negative_correlate|@CHEMICAL_Copper|@CHEMICAL_Penicillamine ;treat|@CHEMICAL_Zinc_Acetate|@DISEASE_Liver_Diseases ;negative_correlate|@CHEMICAL_Copper|@CHEMICAL_Zinc_Acetate ;treat|@CHEMICAL_Trientine|@DISEASE_Neurologic_Manifestations ;negative_correlate|@CHEMICAL_Copper|@CHEMICAL_Trientine ;compare|@CHEMICAL_Trientine|@CHEMICAL_Zinc_Acetate	[Diagnosis and treatment of Wilson disease in Japan].Wilson disease is an autosomal recessive disorder based on inborn error of copper metabolism. The copper accumulates in the liver, brain, cornea, kidney, and other organs. This disease should be considered any individual with liver abnormality except infant, any patient older than teenage with neurological (especially for extra pyramidal signs) or neuropsychiatric disorder with or without liver disease and sibling of Wilson disease patient. Typically, a combination of low serum ceruloplasmine levels and high levels of urinary copper contents is sufficient to establish a diagnosis. As other diagnostic tests, measurement of hepatic copper content and ATP7B gene analysis are available. The key strategy of treatment is to reduce the amount of copper in the liver and other tissues by administering both copper-chelating agents, such as D-penicillamine or Trientine, and/or zinc acetate. The author recommend zinc acetate monotherapy for mild to moderate hepatic disorder, Trientine mono therapy for mild to moderate neurologic disorder and combination therapy of Trientine and zinc acetate for sever hepatic or neurologic disorder.
