31169307	cause|@DISEASE_Hepatolenticular_Degeneration|@VARIANT_p.V536A_ATP7B_human ;cause|@DISEASE_Hepatolenticular_Degeneration|@VARIANT_p.G710S_ATP7B_human ;associate|@CHEMICAL_Copper|@DISEASE_Hepatolenticular_Degeneration ;cause|@DISEASE_Hepatolenticular_Degeneration|@VARIANT_p.G710S_ATP7B_human ;associate|@CHEMICAL_Copper|@DISEASE_Genetic_Diseases_Inborn ;associate|@DISEASE_Hepatolenticular_Degeneration|@GENE_ATP7B	The dilemma to diagnose Wilson disease by genetic testing alone.BACKGROUND: Wilson disease (WD) is an autosomal recessive disorder of hepatic copper excretion. About sixty per cent of patients present with liver disease. WD is considered a fatal disease if undiagnosed and/or untreated but recent data indicate that disease penetrance may not be 100%. MATERIALS AND METHODS: All patients underwent liver biopsy as part of the diagnostic workup. Genetic testing for ATP7B was performed by Sanger sequencing. RESULTS: We report on a large family with multiple affected siblings. The first patient (male, 31 years) underwent orthotopic liver transplantation (OLT) because of fulminant WD. He was homozygous for p.G710A. One asymptomatic brother (37 years) had the same mutation. He is doing well on chelation therapy. Fifteen years later, a second-degree sibling (female, 16 years) presented with fulminant WD and underwent OLT. She was compound heterozygote (p.G710A/p.G710S). Further family screening revealed a third mutation (p.V536A) in a female (21 years) and male (16 years) compound-heterozygote sibling (p.G710A/p.V536A). In both, serum ceruloplasmin and 24-hour urinary copper excretion were normal. Liver biopsy showed normal histology and a quantitative hepatic copper content within the normal range or only slightly elevated (19 and 75 mug/g dry weight, respectively). No decoppering treatment was initiated so far. CONCLUSION: Genetic testing alone is not always sufficient to diagnose WD in asymptomatic patients, and human mutation databases should be used with caution. Even patients carrying two disease-causing mutations do not necessarily have demonstrable alteration of copper metabolism. Asymptomatic siblings diagnosed by genetic screening require further testing before initiating treatment.
33244627		Structural and functional brain changes in hepatic and neurological Wilson disease.Wilson disease (WD) can manifest with hepatic or neuropsychiatric symptoms. Our understanding of the in vivo brain changes in WD, particularly in the hepatic phenotype, is limited. Thirty subjects with WD and 30 age- and gender-matched controls participated. WD group underwent neuropsychiatric assessment. Unified WD Rating Scale neurological exam scores were used to determine neurological (WDN, score > 0) and hepatic-only (WDH, score 0) subgroups. All subjects underwent 3 Tesla anatomical and resting-state functional MRI. Diffusion tensor imaging (DTI) and susceptibility-weighted imaging (SWI) were performed only in the WD group. Volumetric, DTI, and functional connectivity analyses were performed to determine between-group differences. WDN and WDH groups were matched in demographic and psychiatric profiles. The entire WD group compared to controls showed significant thinning in the bilateral superior frontal cortex. The WDN group compared to control and WDH groups showed prominent structural brain changes including significant striatal and thalamic atrophy, more subcortical hypointense lesions on SWI, and diminished white matter integrity in the bilateral anterior corona radiata and corpus callosum. However, the WDH group also showed significant white matter volume loss compared to controls. The functional connectivity between the frontostriatal nodes was significantly reduced in the WDN group, whereas that of the hippocampus was significantly increased in the WDH group compared to controls. In summary, structural and functional brain changes were present even in neurologically non-manifesting WD patients in this cross-sectional study. Longitudinal brain MRI scans may be useful as biomarkers for prognostication and optimization of treatment strategies in WD.
31511488	cause|@CHEMICAL_Copper|@DISEASE_Liver_Failure ;treat|@CHEMICAL_Penicillamine|@DISEASE_Hepatolenticular_Degeneration ;compare|@CHEMICAL_Penicillamine|@CHEMICAL_Zinc_Acetate	Importance of a Liver Biopsy in the Management of Wilson Disease.A 37-year-old Wilson disease patient treated with D-penicillamine visited our hospital for the evaluation of his liver function. Laboratory data showed a low serum copper level and ceruloplasmin. The ratio of urinary copper to urinary creatinine in a spot urinary analysis after 4 days' cessation of D-penicillamine was under 0.1. We concluded that the copper chelation was excessive and changed D-penicillamine to zinc acetate. However, his liver function test results did not normalize. We performed a liver biopsy and discovered a high copper content. The liver dysfunction was improved after resuming chelating therapy. Accurate measurement of the hepatic copper content via a biopsy is important for the adequate management of this disease.
30988085		Exceptional involvement of medulla oblongata in Wilson disease.
33881171	associate|@CHEMICAL_Copper|@DISEASE_Hepatolenticular_Degeneration	Optical coherence tomography in patients with Wilson's disease.OBJECTIVES: Wilson disease (WD) is an autosomal recessive disorder that leads to copper accumulation and deposition in different organs, frequently affecting visual pathways. Recent studies have detected morphological changes of the retina in patients with WD using optical coherence tomography (OCT). Measuring the thickness of the retinal nerve fibre layer (RNFL) with OCT provides an objective assessment of integrity and morphological abnormalities of the retina. The aim of this study was to evaluate the relationship between OCT parameters and form of the disease, therapy and symptoms duration, as well as severity of neurological impairment. METHODS: The study comprised of 52 patients with WD and 52 healthy controls (HC). All the patients were on a regular and stable chelation therapy and/or zinc salts. Patients were divided into two groups, with neurological (NWD) or hepatic form of the disease (HWD). OCT was performed to assess the RNFL thickness. RESULTS: The WD patients had significantly lower intraocular pressure in both eyes and lower RNFL thickness than the HC. There were no differences between NWD and HWD in any of the ophthalmologically tested parameters. No significant correlations were found between clinical features and retinal thickness parameters. Stratification of the cohort according to the disease duration showed that disease duration did not influence the RNFL thickness. CONCLUSION: We found that involvement of the retina represented a subclinical finding in neurologically intact patients in the HWD group. Nevertheless, the value of OCT as a biomarker for the assessment of the clinical course and progression of WD still remains uncertain.
34999690	associate|@CHEMICAL_Copper|@DISEASE_Hepatolenticular_Degeneration ;inhibit|@DISEASE_Hepatolenticular_Degeneration|@GENE_CP	Efficacy of Different Diagnostic Test for Identifying Wilson's Disease.Wilson disease is an autosomal recessive disorder in which copper pathologically accumulates primarily within the liver, brain and other tissues. It can presents clinically as liver disease, as a progressive neurological disorder or as psychiatric illness. The wide array of clinical manifestations of WD can lead to misdiagnosis with subsequent greater risk of irreversible damage to liver and brain. Many tests can be used to investigate patients of Wilson disease, including serum free copper, 24 hours urine copper estimation, hepatic copper estimation and genetic mutation testing. But there is no single ideal diagnostic test that can exclude or confirm the disease with certainty. The aim of the study was to find out the efficacy of different diagnostic test for the diagnosis of Wilson disease. This cross-sectional analytical study was conducted at department of Paediatric Gastroenterology and Nutrition of Bangabandhu Sheikh Mujib Medical University, Dhaka, Bangladesh from January 2016 through January 2018. A total of 56 cases of Wilson disease and 39 patients with a liver disease other than WD were studied. Wilson disease was diagnosed by Leipzig score. Along with other physical findings and laboratory investigations slit lamp eye examination for KF ring, serum ceruloplasmin and 24 hour urinary copper excretion were done. The mean age of WD patients was 9.69+-2.37 years, male female ratio was 1:1. Serum ceruloplasmin level was significantly lower in WD patient (p<0.001). Median of 24 hour urinary copper in WD was 702.75mug/ 24 hr (range119-11210mug/24 hour) and in non WD group it was 77.41mug/24 hour (range 20.0-478mug/24 hour) and the difference between them is statistically significant (p=0.001). The sensitivity of KF ring was 82.1% and specificity was 100%. The sensitivity, specificity, positive predictive value, negative predictive value and accuracy of serum ceruloplasmin were 98.2%, 92.3%, 94.8%, 97.2% and 95.7% respectively. The sensitivity, specificity, positive predictive value, negative predictive value and accuracy of 24 hour urinary copper were 100%, 63%, 80% and 85.1% respectively. The sensitivity, specificity, positive predictive value, negative predictive value and accuracy of KF ring, serum ceruloplasmin and basal 24 hour urinary copper excretion when combined together came out to be 70.4%, 100%, 100%, 59.3% and 79.3% respectively. This study result showed that serum ceruloplasmin and 24 hour urinary copper can be used as a screening test for the diagnosis of Wilson disease.
33640437	associate|@DISEASE_Hepatolenticular_Degeneration|@GENE_ATP7B	Direct Measurement of ATP7B Peptides Is Highly Effective in the Diagnosis of Wilson Disease.BACKGROUND & AIMS: Both existing clinical criteria and genetic testing have significant limitations for the diagnosis of Wilson disease (WD), often creating ambiguities in patient identification and leading to delayed diagnosis and ineffective management. ATP7B protein concentration, indicated by direct measurement of surrogate peptides from patient dried blood spot samples, could provide primary evidence of WD. ATP7B concentrations were measured in patient samples from diverse backgrounds, diagnostic potential is determined, and results are compared with biochemical and genetic results from individual patients. METHODS: Two hundred and sixty-four samples from biorepositories at 3 international and 2 domestic academic centers and 150 normal controls were obtained after Institutional Review Board approval. Genetically or clinically confirmed WD patients with a Leipzig score >3 and obligate heterozygote (carriers) from affected family members were included. ATP7B peptide measurements were made by immunoaffinity enrichment mass spectrometry. RESULTS: Two ATP7B peptides were used to measure ATP7B protein concentration. Receiver operating characteristics curve analysis generates an area under the curve of 0.98. ATP7B peptide analysis of the sequence ATP7B 887 was found to have a sensitivity of 91.2%, specificity of 98.1%, positive predictive value of 98.0%, and a negative predictive value of 91.5%. In patients with normal ceruloplasmin concentrations (>20 mg/dL), 14 of 16 (87.5%) were ATP7B-deficient. In patients without clear genetic results, 94% were ATP7B-deficient. CONCLUSIONS: Quantification of ATP7B peptide effectively identified WD patients in 92.1% of presented cases and reduced ambiguities resulting from ceruloplasmin and genetic analysis. Clarity is brought to patients with ambiguous genetic results, significantly aiding in noninvasive diagnosis. A proposed diagnostic score and algorithm incorporating ATP7B peptide concentrations can be rapidly diagnostic and supplemental to current Leipzig scoring systems.
30541745	cause|@CHEMICAL_CPX_351|@DISEASE_Thrombocytopenia ;treat|@CHEMICAL_CPX_351|@DISEASE_Nephrosis_Lipoid ;cause|@CHEMICAL_CPX_351|@DISEASE_Neutropenia ;treat|@CHEMICAL_CPX_351|@DISEASE_Leukemia_Myeloid_Acute ;treat|@CHEMICAL_CPX_351|@DISEASE_613700	FDA Approval Summary: (Daunorubicin and Cytarabine) Liposome for Injection for the Treatment of Adults with High-Risk Acute Myeloid Leukemia.On August 3, 2017, the FDA granted regular approval to Vyxeos (also known as CPX-351; Jazz Pharmaceuticals), a liposomal formulation of daunorubicin and cytarabine in a fixed combination, for the treatment of adults with newly diagnosed therapy-related acute myeloid leukemia (t-AML) or acute myeloid leukemia (AML) with myelodysplasia-related changes (AML-MRC). Approval was based on data from Study CLTR0310-301, a randomized, multicenter, open-label, active-controlled trial comparing Vyxeos with a standard combination of daunorubicin and cytarabine ("7+3") in 309 patients 60-75 years of age with newly diagnosed t-AML or AML-MRC. Because of elemental copper concerns with the Vyxeos formulation, patients with Wilson disease were excluded from the study. Vyxeos demonstrated an improvement in overall survival (HR 0.69; 95% confidence interval, 0.52-0.90; P = 0.005) with an estimated median overall survival of 9.6 months compared with 5.9 months for the "7+3" control arm. The toxicity profile of Vyxeos was similar to that seen with standard "7+3" with the exception of more prolonged neutropenia and thrombocytopenia on the Vyxeos arm. Because the pharmacology of Vyxeos differs from that of other formulations of daunorubicin and cytarabine, labeling includes a warning against interchanging formulations during treatment. This is the first FDA-approved treatment specifically for patients with t-AML or AML-MRC.
36571168		Nomogram for prediction of portal vein system thrombosis after splenectomy for hypersplenism in patients with Wilson disease.BACKGROUND: The occurrence of portal vein system thrombosis (PVST) after splenectomy in patients with Wilson disease (WD) can lead to serious complications. The early identification of high-risk patients can help improve patient prognosis. This study aimed to establish and validate a personalized nomogram for assessing the risk of PVST after splenectomy in patients with WD and hypersplenism. METHODS: We retrospectively collected the data from 81 patients with WD and hypersplenism who underwent splenectomy. Based on whether PVST occurred within a month after the operation, they were divided into the PVST group and the non-PVST group. The clinical data of the 2 groups were compared, and univariate analysis was used to select the statistically significant features and incorporated into the least absolute shrinkage and selection operator (LASSO) regression model for optimization. Multivariate logistic regression analysis was used to determine the independent risk factors for PVST after splenectomy, which were then applied to establish a personalized nomogram. We calculated the concordance (C)-index and drew the receiver operating characteristic (ROC) curve, the model calibration curve, and the clinical decision analysis (DCA) curve to evaluate the accuracy, calibration, and clinical applicability of the model, respectively. We used bootstrapping for internal validation of the model. RESULTS: Univariate analysis showed that the differences in preoperative portal vein diameter and velocity of portal blood flow, postoperative mean platelet volume (MPV), mean platelet distribution width (PDW), D-dimer, prothrombin time (PT), and the increase of platelet count (PLT) were of statistical significance (P<0.05). According to the results of the LASSO and multivariate logistic regression analyses, a model including preoperative portal vein diameter, preoperative portal blood flow velocity, postoperative D-dimer, and the increase of PLT was established to predict the risk of PVST after splenectomy. The model showed good accuracy with a C-index of 0.838 (95% CI: 0.750-0.926) and had a well-fitted calibration curve. Furthermore, internal validation showed it achieved a moderate C-index of 0.805. The DCA curve indicated that the model has clinical applicability when patients are treated at thresholds of 2-100%. CONCLUSIONS: Establishing a predictive model for the risk of PVST in patients with WD and hypersplenism after splenectomy can help clinicians identify patients at high risk of PVST who require intervention measures.
35470480	association|@VARIANT_c.51+2T>G_ATP7B_human|@DISEASE_Hepatolenticular_Degeneration ;association|@VARIANT_c.3532_3535del_ATP7B_human|@DISEASE_Hepatolenticular_Degeneration ;association|@VARIANT_c.1543+40G>A_ATP7B_human|@DISEASE_Hepatolenticular_Degeneration ;associate|@DISEASE_Genetic_Diseases_Inborn|@GENE_ATP7B ;associate|@CHEMICAL_Copper|@GENE_ATP7B ;associate|@DISEASE_Hepatolenticular_Degeneration|@GENE_ATP7B ;associate|@DISEASE_Hepatolenticular_Degeneration|@GENE_ATP7B	Genetic studies discover novel coding and non-coding mutations in patients with Wilson's disease in China.OBJECTIVES: Wilson disease (WD) is a rare autosomal recessive genetic disorder associated with various mutations in the ATP7B gene and leads to significant disability or death if untreated. Early diagnosis and proper therapy usually predict a good prognosis, especially in pre-symptomatic WD. Genetic testing provides an accurate and effective diagnostic method for the early diagnosis of WD. METHODS: We recruited 18 clinically diagnosed WD patients from 16 unrelated families and two independent individuals. The next-generation sequencing of the ATP7B gene was performed. The 293T cell lines were divided into wild-type (WT) ATP7B and mutated ATP7B groups. Cell proliferation was determined by Cell Counting Kit-8 (CCK-8) assay and apoptosis was detected by Annexin V/propidium iodide (PI) assays. RESULTS: Pedigree analysis showed that compound heterozygous variants (17/18, 94.44%) were present in the majority of WD patients. A total of 33 ATP7B gene variants were identified, including three variants with uncertain significance (VUS) [two splice mutations (c.51+2T>G, c.1543+40G>A) and one frameshift mutation (c.3532_3535del)]. The CCK-8 and apoptosis assays demonstrated that the VUS of ATP7B could significantly affect the transportation of copper. CONCLUSIONS: The study revealed genetic defects of 16 Chinese families and two independent individuals with WD, which enriched the mutation spectrum of the ATP7B gene worldwide and provided valuable information for studying the mutation types of ATP7B in the Chinese populations. Genetic testing in WD patients is necessary to shorten the time to initiate therapy, reduce damage to the liver and improve the prognosis.
30936238		Teaching Video NeuroImages: Myoclonus as the presenting feature of Wilson disease.
34320232	associate|@DISEASE_Copper_deficiency_familial_benign|@GENE_ATP7B ;associate|@DISEASE_Hepatolenticular_Degeneration|@GENE_ATP7B	Designing Clinical Trials in Wilson's Disease.BACKGROUND AND AIMS: Wilson's disease (WD) is an autosomal-recessive disorder caused by ATP7B gene mutations leading to pathological accumulation of copper in the liver and brain. Adoption of initial treatments for WD was based on empirical observations. These therapies are effective, but there are still unmet needs for which treatment modalities are being developed. An increase of therapeutical trials is anticipated. APPROACH AND RESULTS: The first Wilson Disease Aarhus Symposium (May 2019) included a workshop on randomized clinical trial design. The authors of the article were organizers or presented during this workshop, and this article presents their consensus on the design of clinical trials for WD, addressing trial population, treatment comparators, inclusion and exclusion criteria, and treatment endpoints. To achieve adequate recruitment of patients with this rare disorder, the study groups should include all clinical phenotypes and treatment-experienced as well as treatment-naive patients. CONCLUSIONS: The primary study endpoint should be clinical or a composite endpoint until appropriate surrogate endpoints are validated. Standardization of clinical trials will permit pooling of data and allow for better treatment comparisons, as well as reduce the future numbers of patients needed per trial.
29358698	associate|@DISEASE_Hepatolenticular_Degeneration|@VARIANT_p.R778L_ATP7B_human ;cause|@CHEMICAL_Copper|@DISEASE_Hepatolenticular_Degeneration ;associate|@DISEASE_Hepatolenticular_Degeneration|@GENE_ATP7B ;associate|@DISEASE_Hepatolenticular_Degeneration|@GENE_ATP7B	Production of Wilson Disease Model Rabbits with Homology-Directed Precision Point Mutations in the ATP7B Gene Using the CRISPR/Cas9 System.CRISPR/Cas9 has recently been developed as an efficient genome engineering tool. The rabbit is a suitable animal model for studies of metabolic diseases. In this study, we generated ATP7B site-directed point mutation rabbits to simulate a major mutation type in Asians (p. Arg778Leu) with Wilson disease (WD) by using the CRISPR/Cas9 system combined with single-strand DNA oligonucleotides (ssODNs). The efficiency of the precision point mutation was 52.94% when zygotes were injected 14 hours after HCG treatment and was significantly higher than that of zygotes injected 19 hours after HCG treatment (14.29%). The rabbits carrying the allele with mutant ATP7B died at approximately three months of age. Additionally, the copper content in the livers of rabbits at the onset of WD increased nine-fold, a level similar to the five-fold increase observed in humans with WD. Thus, the efficiency of precision point mutations increases when RNAs are injected into zygotes at earlier stages, and the ATP7B mutant rabbits are a potential model for human WD disease with applications in pathological analysis, clinical treatment and gene therapy research.
29449431	associate|@CHEMICAL_Copper|@DISEASE_Hepatolenticular_Degeneration ;associate|@CHEMICAL_Copper|@DISEASE_Copper_deficiency_familial_benign	Wilson disease: more than meets the eye.Wilson disease is a rare but important disorder of copper metabolism, with a failure to excrete copper appropriately into bile. It is a multisystem condition with presentations across all branches of medicine. Diagnosis can be difficult and requires a high index of suspicion. It should be considered in unexplained liver disease particularly where neuropsychiatric features are also present. Treatments are available for all stages of disease. A particularly important presentation not to overlook is acute liver failure which carries a high mortality risk and may require urgent liver transplantation. Here, we provide an overview of this complex condition.
32291276	associate|@VARIANT_p.T977M_ATP7B_human|@VARIANT_p.T977M_ATP7B_human ;associate|@VARIANT_p.T977M_ATP7B_human|@VARIANT_p.T977M_ATP7B_human ;cause|@DISEASE_Diabetes_Mellitus|@VARIANT_c.525dupA_ATP7B_human ;associate|@CHEMICAL_Glucose|@GENE_INS ;association|@VARIANT_p.T977M_ATP7B_human|@DISEASE_Hepatolenticular_Degeneration ;associate|@VARIANT_c.525dupA_ATP7B_human|@VARIANT_c.525dupA_ATP7B_human ;associate|@VARIANT_p.T977M_ATP7B_human|@VARIANT_p.T977M_ATP7B_human ;treat|@CHEMICAL_Succimer|@DISEASE_Skin_Diseases ;associate|@CHEMICAL_Glucose|@GENE_ATP7B ;associate|@DISEASE_Hepatolenticular_Degeneration|@VARIANT_c.525dupA_ATP7B_human ;associate|@VARIANT_p.T977M_ATP7B_human|@VARIANT_c.525dupA_ATP7B_human ;associate|@DISEASE_Hepatolenticular_Degeneration|@VARIANT_p.T977M_ATP7B_human ;associate|@DISEASE_Hepatolenticular_Degeneration|@VARIANT_p.T977M_ATP7B_human ;positive_correlation|@VARIANT_c.525dupA_ATP7B_human|@DISEASE_Diabetes_Mellitus ;negative_correlate|@CHEMICAL_Succimer|@CHEMICAL_Glucose ;association|@VARIANT_c.525dupA_ATP7B_human|@DISEASE_Hepatolenticular_Degeneration ;associate|@DISEASE_Hepatolenticular_Degeneration|@VARIANT_c.525dupA_ATP7B_human ;cause|@DISEASE_Diabetes_Mellitus|@VARIANT_c.525dupA_ATP7B_human ;associate|@CHEMICAL_Penicillamine|@GENE_ATP7B ;cause|@DISEASE_Diabetes_Mellitus|@VARIANT_p.T977M_ATP7B_human ;treat|@CHEMICAL_Penicillamine|@DISEASE_Skin_Diseases ;positive_correlation|@VARIANT_p.T977M_ATP7B_human|@DISEASE_Diabetes_Mellitus ;associate|@DISEASE_Hepatolenticular_Degeneration|@GENE_ATP7B ;positive_correlate|@CHEMICAL_Glucose|@CHEMICAL_Penicillamine ;cause|@DISEASE_Diabetes_Mellitus|@VARIANT_p.T977M_ATP7B_human ;treat|@CHEMICAL_Penicillamine|@DISEASE_Hepatolenticular_Degeneration ;associate|@CHEMICAL_Succimer|@GENE_INS ;associate|@VARIANT_c.525dupA_ATP7B_human|@VARIANT_c.525dupA_ATP7B_human ;inhibit|@CHEMICAL_Penicillamine|@VARIANT_c.525dupA_ATP7B_human ;associate|@DISEASE_Diabetes_Mellitus|@GENE_ATP7B ;treat|@CHEMICAL_Succimer|@DISEASE_Hepatolenticular_Degeneration ;associate|@DISEASE_Diabetes_Mellitus|@GENE_ATP7B ;associate|@DISEASE_Hepatolenticular_Degeneration|@GENE_ATP7B	Wilson Disease With Novel Compound Heterozygote Mutations in the ATP7B Gene Presenting With Severe Diabetes.OBJECTIVE: To determine the relationship between ATP7B mutations and diabetes in Wilson disease (WD). RESEARCH DESIGN AND METHODS: A total of 21 exons and exon-intron boundaries of ATP7B were identified by Sanger sequencing. RESULTS: Two novel compound heterozygous mutations (c.525 dupA/ Val176Serfs*28 and c.2930 C>T/ p.Thr977Met) were detected in ATP7B. After d-penicillamine (D-PCA) therapy, serum aminotransferase and ceruloplasmin levels in this patient were normalized and levels of HbA1c decreased. However, when the patient ceased to use D-PCA due to an itchy skin, serum levels of fasting blood glucose increased. Dimercaptosuccinic acid capsules were prescribed and memory recovered to some extent, which was accompanied by decreased insulin dosage for glucose control by 5 units. CONCLUSIONS: This is the first report of diabetes caused by WD.
