Ratings,PMID        Text,,,,,,,,,,,,,,,,,,,,,,,,,,,,,,,,,,,,,,,,,,,,,,,,,,,,,,,,,,,,,,,,,,,,,,,,,,,,,,,,,,,,,,,
NEGATIVE,"38012299	""Looking ahead: ethical and social challenges of somatic gene therapy for sickle cell disease in Africa. Somatic gene therapy will be one of the most exciting practices of genetic medicine in Africa and is primed to offer a """"new life"""" for persons living with sickle cell disease (SCD). Recently",successful gene therapy trials for SCD in the USA have sparked a ray of hope within the SCD community in Africa. However,the high cost,estimated to exceed 1.5 million USD,continues to be a major concern for many stakeholders. While affordability is a key global health equity consideration,it is equally important to reflect on other ethical,legal and social issues (ELSIs) that may impact the responsible implementation of gene therapy for SCD in Africa. These include informed consent comprehension,risk of therapeutic misestimation and optimistic bias; priorities for SCD therapy trials; dearth of ethical and regulatory oversight for gene therapy in many African countries; identifying a favourable risk-benefit ratio; criteria for the selection of trial participants; decisional conflict in consent; standards of care; bounded justice; and genetic tourism. Given these ELSIs,we suggest that researchers,pharma,funders,global health agencies,ethics committees,science councils and SCD patient support/advocacy groups should work together to co-develop: (1) patient-centric governance for gene therapy in Africa,(2) public engagement and education materials,and (3) decision making toolkits for trial participants. It is also critical to establish harmonised ethical and regulatory frameworks for gene therapy in Africa,and for global health agencies to accelerate access to basic care for SCD in Africa,"while simultaneously strengthening capacity for gene therapy.""",,,,,,,,,,,,,,,,,,,,,,,,,,,,,,,,,,,,,,,,,,,,,,,,,,,,,,,,,,,,,,,,,,,,,,
NEGATIVE,32267841	Influence of sickle cell disease on susceptibility to HIV infection. People with sickle cell disease (SCD) are reported to have low rates of HIV infection,slower progression to AIDS and lower HIV-associated mortality compared to the general population. Mechanisms of potential resistance to HIV in SCD are incompletely understood. We retrospectively reviewed the Transfusion Safety Study to compare HIV status between people with SCD and other congenital anemias who were routinely exposed to blood products during the high-risk period before HIV screening implementation. Non-SCD congenital anemia diagnosis was associated with a higher risk of HIV acquisition compared to SCD (OR 13.1 95%CI 1.6-108.9). In addition,we prospectively enrolled 30 SCD cases and 30 non-SCD controls to investigate potential mechanisms of resistance to HIV in SCD. CCR5 and CCR7 expression was lower and CD4 expression was higher on CD4+ T cells from SCD cases compared to controls. Surface expression of CD4+ T cell CXCR4,CD38 and HLA-DR did not differ between the groups. SCD CD4+ T cells were not less susceptible to HIV infection than controls. Levels of multiple cytokines were elevated in the SCD plasma,but SCD plasma compared to control plasma did not inhibit HIV infection of target cells. In conclusion,our epidemiological data support people with SCD being resistant to HIV infection. Potential mechanisms include lower CD4+ T cell expression of CCR5 and CCR7,balanced by increased CD4 expression and cytokine levels,which did not result in in vitro resistance to HIV infection. Further study is needed to define the risk and pathophysiology of HIV in persons with SCD.,,,,,,,,,,,,,,,,,,,,,,,,,,,,,,,,,,,,,,,,,,,,,,,,,,,,,,,,,,,,,,,,,,,,,,,,,,,,,,,,
NEGATIVE,32171610	Longitudinal Relationships Between Depression and Chronic Illness in Adolescents: An Integrative Review. INTRODUCTION: Depression is prevalent among adolescents with chronic illness. However,little is known about how depression affects chronic illness over time. This review aimed to synthesize longitudinal relationships between depression and disease control,self-management behaviors,illness-related morbidity,and quality of life. METHOD: Four databases were searched,including PubMed,Cumulative Index of Nursing and Allied Health Literature,PsycINFO,and EMBASE. Inclusion criteria were cohort studies examining depression among adolescents aged 10-21 years with a chronic illness and studies published in English. Study quality was appraised using the Newcastle-Ottawa scale and data was synthesized by the outcome. RESULTS: Of the 3,463 articles identified,11 were included in the review. For adolescents with diabetes,increased depressive symptoms predicted decreased metabolic control and monitoring,medication adherence,quality of life,and increased hospitalization. Studies on cystic fibrosis,congenital heart disease,sickle cell disease,and juvenile idiopathic arthritis were limited but demonstrated that depressive symptoms affected the quality of life,disability,pain,and hospitalization rates/costs. DISCUSSION: Evidence supports the need for mental health care strategies suitable for adolescents with chronic illness. Future research is needed to examine the effects of depressive symptoms across diversified chronic illness populations.,,,,,,,,,,,,,,,,,,,,,,,,,,,,,,,,,,,,,,,,,,,,,,,,,,,,,,,,,,,,,,,,,,,
NEGATIVE,29666675	Transfusion in Haemoglobinopathies: Review and recommendations for local blood banks and transfusion services in Oman. Sickle cell disease and homozygous beta-thalassaemia are common haemoglobinopathies in Oman,with many implications for local healthcare services. The transfusions of such patients take place in many hospitals throughout the country. Indications for blood transfusions require local recommendations and guidelines to ensure standardised levels of care. This article summarises existing transfusion guidelines for this group of patients and provides recommendations for blood banks and transfusion services in Oman. This information is especially pertinent to medical professionals and policy-makers developing required services for the standardised transfusion support of these patients.,,,,,,,,,,,,,,,,,,,,,,,,,,,,,,,,,,,,,,,,,,,,,,,,,,,,,,,,,,,,,,,,,,,,,,,,,,,,,,,,,,,,,,
NEGATIVE,36510904	Impact of hydroxyurea on hospital stay & analgesic utilization in sickle cell anaemia with vaso-occlusive crises. Background & objectives: Hydroxyurea (HU) has been useful in preventing sickle cell vaso-occlusive crises (VOC). A few studies also suggest utility of HU,during acute VOC. Sickle cell anaemia (SCA) is of high prevalence in western districts of Odisha State,India,and VOC is a common presentation,despite being mostly of Arab-Indian haplotype. This study was undertaken to evaluate the impact of HU on hospital stay and analgesic utilization in acute painful VOC of SCA. Methods: Homozygous sickle cell disease (HbSS) patients were categorized as cases who were receiving low-dose HU (10 mg/kg/day) and patients who were not on HU were considered as control. Days of hospital stay,analgesic utilization and visual analogue scale (VAS) score in patients were compared with that of control. Analgesics used to control pain were tramadol hydrochloride,ketorolac and diclofenac. Results: A total of 359 homozygous sickle cell disease (SCD) patients with VOC were studied (187 patients and 172 controls). The patient group had lesser mean days of hospital stay (1.4 days less than controls,P<0.001) and required lesser days of analgesic utilization than controls (1.18 days less than controls,P<0.001). Significant differences were observed between patients and controls concerning VAS score and amount of tramadol hydrochloride,ketorolac and diclofenac utilization (P<0.05). Interpretation & conclusions: In this study,HU was found to have beneficial effects in acute VOC of homozygous SCD,which includes shortening the duration of hospital stay and reducing the net amount of analgesic utilization during hospitalization.,,,,,,,,,,,,,,,,,,,,,,,,,,,,,,,,,,,,,,,,,,,,,,,,,,,,,,,,,,,,,,,,,,,,,,,,,,,,
NEGATIVE,33026052	Outcomes of multidisciplinary team interventions in the management of sickle cell disease patients with opioid use disorders. A retrospective cohort study. OBJECTIVES: To identify the magnitude of opioid use disorder (OUD) among sickle cell disease (SCD) patients; emphasize on multidisciplinary team (MDT) role; estimate cost-effectiveness following the proper use of therapeutic guidelines; and facilitate the reduction of emergency room (ER) visits and the length of stay (LOS). METHODS: This retrospective cohort study included SCD patients aged 14 years and above,who have OUD. Data was collected between January 2016 and December 2018. Data included ER visits,hospital LOS,opioid consumption,and narcotic prescription tracking. The target group was followed with a set of interventions for pain management and healthcare resource utilization. Results: Twenty one SCD patients were identified with OUD. Following the interventions,there was a statistically significant decrease in ER visits of these OUD patients (from 8709 visits in 2016 to only 94 in 2018). Morphine consumption decreased by 82% and meperidine by 60%,over the 3-year period. Moreover,there was a huge reduction in both ER and LOS costs for this cohort of patients. CONCLUSION: Establishing an MDT and a series of interventions for SCD patients with OUD,including educational activities for caregivers and patients; establishing a palliative/pain clinic and a SCD addiction clinic; and implementing an adequate opioid prescription tracking system resulted in a significant reduction in both the cost and number of ER visits and hospital LOS and dramatically decreased opioid consumption.,,,,,,,,,,,,,,,,,,,,,,,,,,,,,,,,,,,,,,,,,,,,,,,,,,,,,,,,,,,,,,,,,,,,,,,,,,,,,,,
NEGATIVE,33519708	Consequences of beta-Thalassemia or Sickle Cell Disease for Ovarian Follicle Number and Morphology in Girls Who Had Ovarian Tissue Cryopreserved. Women with beta-thalassemia (BT) and sickle cell disease (SCD) have a high risk of infertility and premature ovarian insufficiency. Different fertility preserving strategies,including ovarian tissue cryopreservation (OTC) and oocyte cryopreservation has been considered,and healthy babies have been born after successful OTC and transplantation. We evaluated follicle number and follicle health in ovarian tissue from a cohort of BT and SCD patients who underwent OTC before the age of 18 years. Patients undergoing OTC from 2002 to 2019 were included. A total of 14 girls and adolescents with BT and four with SCD,aged 2.8-17.4 years at OTC were included together with a reference group of 43 girls and adolescents with non-anemia diseases considered to have normal ovaries aged 0.6-17.9 years at OTC. Ovarian follicle density was measured in cortex biopsies and compared to the reference group. Expression of proteins associated with follicular health was evaluated using immunohistochemistry. Follicles were detected in the ovarian cortex biopsies from all patients with BT and SCD. The follicle densities were within the 95% prediction interval of the reference group in all cases. A similar expression of six proteins essential for follicular health was detected using immunohistochemistry in BT,SCD,and references. OTC should be considered an option for young girls and adolescents with BT and SCD.,,,,,,,,,,,,,,,,,,,,,,,,,,,,,,,,,,,,,,,,,,,,,,,,,,,,,,,,,,,,,,,,,,,,,,,,,,,,,,,,,,
NEGATIVE,37158403	Impact of prenatal corticosteroid therapy on sickle cell disease in pregnant women. OBJECTIVE: To evaluate safety of prenatal corticosteroids in pregnancies of women with sickle cell disease. METHODS: A multicenter observational study of patients with sickle cell disease,comparing vaso-occlusive crises (VOC) requiring hospital care between pregnancies with versus without prenatal corticosteroids. RESULTS: In 40 pregnancies exposed to prenatal corticosteroids,compared with 370 unexposed pregnancies,VOC were not more frequent (62.5% vs 57.9%,P = 0.578) but they were more severe,with more intensive care hospitalizations (25.0% vs 12.9%,P = 0.039),emergency transfusions (44.7% vs 22.7%,P = 0.006),and acute chest syndromes (22.5% vs 8.9%,P = 0.010). These differences persisted after adjustment for severity and type of sickle cell syndrome (for intensive care admission adjusted odds ratio [aOR] 2.73,95% confidence interval [CI] 1.10-6.79,P = 0.031 and for acute chest syndrome aOR 4.15,95% CI 1.57-14.4,P = 0.008). VOC occurred on average 1.2 days following steroid administration. When comparing 36 patients receiving corticosteroids for fetal maturation with 58 patients who were hospitalized for obstetrical complications before 34 weeks of pregnancy but that did not receive corticosteroids,VOC incidence was not significantly higher (41.7% vs 31.5%,P = 0.323). CONCLUSION: The present study was the first to study the impact of prenatal corticosteroids on sickle cell disease. They were associated with more severe VOC,suggesting that steroids should be avoided in these women.,,,,,,,,,,,,,,,,,,,,,,,,,,,,,,,,,,,,,,,,,,,,,,,,,,,,,,,,,,,,,,,,,,,,,,
NEGATIVE,30548773	Impact of erythrocytapheresis on natural anticoagulant levels in children with sickle cell disease: A pilot study. Venous thromboembolism (VTE) is being increasingly recognized in children with sickle cell disease (SCD). In a retrospective cohort study,we identified bilateral central venous catheter (CVC) placement as an independent risk factor for VTE. At our institution,the only indication for bilateral CVC placement in children with SCD is erythrocytapheresis. To investigate the impact of erythrocytapheresis on coagulation,we measured levels of natural anticoagulants in 11 patients with SCD on chronic erythrocytapheresis,immediately before and after apheresis. We demonstrated a statistically significant reduction in most parameters. Additional studies are needed to further investigate the exact etiology and clinical impact of this acute decrease.,,,,,,,,,,,,,,,,,,,,,,,,,,,,,,,,,,,,,,,,,,,,,,,,,,,,,,,,,,,,,,,,,,,,,,,,,,,,,,,,,,,
NEGATIVE,33097032	Characterization of HIV risks in a Brazilian sickle cell disease population. BACKGROUND: A low prevalence of HIV in sickle cell disease (SCD) patients has been reported in the literature though mechanisms for this are not understood. METHODS: HIV risk behaviors were compared between SCD cases and non-SCD controls using a self-administered audio computer-assisted self-interview. SCD cases were recruited from a multi-center SCD cohort established in Brazil; controls were recruited from SCD social contacts. Categorical variables were analyzed using Chi-Square or Fisher exact test. Continuous variables were compared using the Mann-Whitney U test. RESULTS: There were 152 SCD cases and 154 age/location matched controls enrolled at three participating Brazilian centers during 2016-17. No significant differences in number of sexual partners (lifetime or previous 12 months),male-to-male sex partners or intravenous drug use were observed. Cases received more transfusions,surgeries,and acupuncture treatment. CONCLUSIONS: Besides the risk of transfusion-transmitted HIV,which is now exceedingly rare,SCD and non-SCD participants demonstrated similar HIV risk behaviors. Causes other than risk behaviors such as factors inherent to SCD pathophysiology may explain the reported low prevalence of HIV in SCD.,,,,,,,,,,,,,,,,,,,,,,,,,,,,,,,,,,,,,,,,,,,,,,,,,,,,,,,,,,,,,,,,,,,,,,,,,,,,,,,,,,
NEGATIVE,32034210	Epidemiology and Predictors of all-cause 30-Day readmission in patients with sickle cell crisis. The 30-day readmission rate after hospitalization for a sickle cell crisis (SCC) is extremely high. Accurate information on readmission diagnoses,total readmission costs and factors associated with readmission is required to effectively plan resource allocation and to plan interventions to reduce readmission rates. The present study aimed to examine readmission diagnoses and factors associated with all-cause 30-day readmission after hospitalization for SCC. We analyzed 2016 nationwide readmission database (NRD) to identify patterns of 30-day readmission by patient demographic characteristics and time after hospitalization for SCC. We estimated the percentage and most common readmission diagnoses for 30-day and 7-day readmissions after discharge. We studied the relationship between risk factors and readmission and the impact of readmission on patient outcomes and resulting financial burden on health care in dollars. In 2016,of 67,887 discharges after index hospitalizations,18099 (26.9%) were readmitted within 30-days. Of all readmissions,5166 (7.6%) were readmitted within 7 days. The spectrum of readmission diagnoses was largely similar in both 30-day and 7-day readmission with more than 80% patients in both time periods readmitted with diagnoses related to SCC. The mean length of stay for readmitted patients was significantly longer than the index hospitalization (5.3 days (5.1-5.5) vs 4.9 days (CI 4.8-5.1,p < 0.01). Also,the mean cost of hospitalization in readmitted patients $8485 was significantly higher than the index hospitalization $8064 p < 0.01. In 2016,readmission among patients with SCC incurred an additional 95,445 hospitalization days resulting a total charge of $609 million and a total cost of $152 million in the US. On Multivariate analysis,age group 18-30 years,discharge against medical advice,higher Charlson comorbidity index,low socioeconomic status and admission at high volume centers were associated with a higher likelihood of 30-day readmission. Among patients hospitalized for SCC,30-day readmissions were frequent throughout the month post hospitalization and resulted in an enormous financial burden on the United States healthcare system.,,,,,,,,,,,,,,,,,,,,,,,,,,,,,,,,,,,,,,,,,,,,,,,,,,,,,,,,,,,,,,,,,,,,,,,,,
NEGATIVE,29048550	Altered Neurophysiological Processing of Auditory Attention in Preschool Children With Sickle Cell Disease. Objective: Sickle cell disease (SCD) is a genetic red blood cell disorder that often leads to stroke and executive dysfunction in school-age children and adults. This study aimed to characterize the development of the neural correlates of selective attention,an early component of executive function,in preschool children with SCD. Methods: Auditory event-related potentials (ERPs) were recorded while children attended to a story stream in one ear and ignored a second story in the other ear interchangeably. In total,12 patients (mean age = 5.5,7 males) and 22 typically developing children (mean age = 4.4,10 males) were included in the final analyses. Results: By 100 ms,more positive ERP amplitudes were observed for attended relative to unattended stimuli in typically developing children but not those with SCD,suggesting deficits in the ability to focus attention. Reduced attention effects were associated with lower performance intellectual quotient. Conclusion: There are deficits in early attention modulation in young children with SCD.,,,,,,,,,,,,,,,,,,,,,,,,,,,,,,,,,,,,,,,,,,,,,,,,,,,,,,,,,,,,,,,,,,,,,,,,,,,,,,,,
NEGATIVE,35836008	Phenotypes of sickle cell intensive care admissions: an unsupervised machine learning approach in a single-center retrospective cohort. Sickle cell disease (SCD) is associated with multiple known complications and increased mortality. This study aims to further understand the profile of intensive care unit (ICU) admissions of SCD patients. In this single-center retrospective cohort (approval number 0926-11),we evaluated SCD-related ICU admissions at our hospital in Sao Paulo,Brazil. Admissions were clustered using clinical data and organ dysfunction at ICU admission. A hierarchical clustering method was used to distinguish phenotypes. From 140 admissions obtained,125 were included. The mean age was 30 years,48% were male,and SS genotype was predominant (71.2%). Non-surgical causes of admissions accounted for 85.6% (n = 107). The mean Sequential Organ Failure Assessment score (SOFA) was 4 (IQR 2-7). Vasopressors were required by 12% and mechanical ventilation by 17.6%. After analysis of the average silhouette width,the optimal number of clusters was 3: cluster 1 (n = 69),cluster 2 (n = 25),cluster 3 (n = 31). Cluster 1 had a mean age of 29 years,87% of SS genotype,and mean SOFA of 4. Cluster 2 had a mean age of 37 years,80% of SS genotype,and mean SOFA of 8. Cluster 3 had a mean age of 26 years,29% of SS genotype,and mean SOFA of 3. The need for mechanical ventilation was 11.6%,$0.44,and 9.7%,respectively. Mortality was significantly higher in cluster 2 (44%,p = 0.012). This cohort of critical SCD admissions suggested the presence of three different profiles. This can be informative in the ICU setting to identify SCD patients at higher risk of worse outcomes.,,,,,,,,,,,,,,,,,,,,,,,,,,,,,,,,,,,,,,,,,,,,,,,,,,,,,,,,,,,,,,,,,,,,,
NEGATIVE,35456398	Vignette-Based Reflections to Inform Genetic Testing Policies in Living Kidney Donors. Family history of kidney disease increases risk of end-stage kidney disease (ESKD) in donors. Pre-donation genetic testing is recommended in evaluation guidelines and regulatory policy. Collaborating across several institutions,we describe cases to illustrate the utility as well as practical issues in incorporating genetic testing in transplant protocols. Case 1 is from 2009,before pervasive genetic testing. A healthy 27-year-old Caucasian male had an uneventful donor evaluation for his mother,who had early onset ESKD of unclear cause. He participated in paired-exchange kidney donation,but developed progressive kidney disease and gout over the next 10 years. A uromodulin gene mutation (NM_003361.3(UMOD):c.377 G>A p.C126Y) was detected and kidney biopsy showed tubulointerstitial kidney disease. The patient subsequently required kidney transplantation himself. Case 2 was a 36-year-old African American female who had an uneventful kidney donor evaluation. She underwent gene panel-based testing to rule out ApolipoproteinL1 risk variants,for which was negative. Incidentally,a sickle-cell trait (NM_000518.5(HBB):c.20A>T p.Glu7Val) was noted,and she was declined for kidney donation. This led to significant patient anguish. Case 3 was a 26-year-old Caucasian female who underwent panel-based testing because the potential recipient,her cousin,carried a variant of uncertain significance in the hepatocyte nuclear factor-1-beta (HNF1B) gene. While the potential donor did not harbor this variant,she was found to have a likely pathogenic variant in complement factor I (NM_000204.4(CFI):c.1311dup:p.Asp438Argfs*8),precluding kidney donation. Our cases emphasize that while genetic testing can be invaluable in donor evaluation,transplant centers should utilize detailed informed consent,develop care pathways for secondary genetic findings,and share experience to develop best practices around genetic testing in donors.,,,,,,,,,,,,,,,,,,,,,,,,,,,,,,,,,,,,,,,,,,,,,,,,,,,,,,,,,,,,,,,,,,,,,,,,,
NEGATIVE,35059711	Standardizing Opioid Prescribing in a Pediatric Hospital: A Quality Improvement Effort. BACKGROUND: Opioids are indicated for moderate-to-severe pain caused by trauma,ischemia,surgery,cancer and sickle cell disease,and vaso-occlusive episodes (SCD-VOC). There is only limited evidence regarding the appropriate number of doses to prescribe for specific indications. Therefore,we developed and implemented an opioid prescribing algorithm with dosing guidelines for specific procedures and conditions. We aimed to reach and sustain 90% compliance within 1 year of implementation. METHODS: We conducted this quality improvement effort at a pediatric academic quaternary care institution. In 2018,a multidisciplinary team identified the need for a standard approach to opioid prescribing. The algorithm guides prescribers to evaluate the medical history,physical examination,red flags,pain type,and to initiate opioid-sparing interventions before prescribing opioids. Opioid prescriptions written between January 2015 and September 2020 were included. Examples from 2 hospital departments will be highlighted. Control charts for compliance with guidelines and variability in the doses prescribed are presented for selected procedures and conditions. RESULTS: Over 5 years,83 037 opioid prescriptions in 53 804 unique patients were entered electronically. The encounters with >=1 opioid prescription decreased from 48% to 25% between 2015 and 2019. Compliance with the specific guidelines increased to ~85% for periacetabular osteotomies and SCD-VOC and close to 100% for anterior-cruciate ligament surgery. In all 3 procedures and conditions,variability in the number of doses prescribed decreased significantly. CONCLUSION: We developed an algorithm,guidelines,and a process for improvement. The number of opioid prescriptions and variability in opioid prescribing decreased. Future evaluation of specific initiatives within departments is needed.,,,,,,,,,,,,,,,,,,,,,,,,,,,,,,,,,,,,,,,,,,,,,,,,,,,,,,,,,,,,,,,,,,,,,,,,,
