Ratings,PMID        Text,,,,,,,,,,,,,,,,,,,,,,,,,,,,,,,,,,,,,,,,,,,,,,,,,,,,,,,,,,,,,,,,,,,,,,,,,,,,,,,,,,,,,,,
NEGATIVE,30265442	Mouse Models of Pain in Sickle Cell Disease. Sickle cell disease (SCD) is a genetic blood disorder that impacts millions of individuals worldwide. SCD is characterized by debilitating pain that can begin during infancy and may continue to increase throughout life. This pain can be both acute and chronic. A characteristic feature specific to acute pain in SCD occurs during vaso-occlusive crisis (VOC) due to the blockade of capillaries with sickle red blood cells. The acute pain of VOC is intense,unpredictable,and requires hospitalization. Chronic pain occurs in a significant population with SCD. Treatment options for sickle pain are limited and primarily involve the use of opioids. However,long-term opioid use is associated with numerous side effects. Thus,pain management in SCD remains a major challenge. Humanized transgenic mice expressing exclusively human sickle hemoglobin show features of pain and pathobiology similar to that in patients with SCD. Therefore,these mice offer the potential for investigating the mechanisms of pain in SCD and allow for development of novel targeted analgesic therapies.   2018 by John Wiley & Sons,Inc.,,,,,,,,,,,,,,,,,,,,,,,,,,,,,,,,,,,,,,,,,,,,,,,,,,,,,,,,,,,,,,,,,,,,,,,,,,,,,,,,,
NEGATIVE,33658643	Correction of murine sickle cell disease by allogeneic haematopoietic cell transplantation with anti-3rd party veto cells. Despite advances in gene therapy allogeneic hematopoietic stem cell transplants (HSCT) remains the most effective way to cure sickle cell disease (SCD). However,there are substantial challenges including lack of suitable donors,therapy-related toxicity (TRM) and risk of graft-versus-host disease (GvHD). Perhaps the most critical question is when to do a transplant for SCD. Safer transplant protocols for HLA-disparate HSCT is needed before transplants are widely accepted for SCD. Although risk of GvHD and TRM are less with T-cell-deplete HSCT and reduced-intensity conditioning (RIC),transplant rejection is a challenge. We have reported graft rejection of T cell-depleted non-myeloablative HSCT can be overcome in wild type fully mis-matched recipient mice,using donor-derived anti-3rd party central memory CD8-positive veto cells combined with short-term low-dose rapamycin. Here,we report safety and efficacy of this approach in a murine model for SCD. Durable donor-derived chimerism was achieved using this strategy with reversal of pathological parameters of SCD,including complete conversion to normal donor-derived red cells,and correction of splenomegaly and the levels of circulating reticulocytes,hematocrit,and hemoglobin.,,,,,,,,,,,,,,,,,,,,,,,,,,,,,,,,,,,,,,,,,,,,,,,,,,,,,,,,,,,,,,,,,,,,,,,,,,,,,,
NEGATIVE,31178391	Editing the Sickle Cell Disease Mutation in Human Hematopoietic Stem Cells: Comparison of Endonucleases and Homologous Donor Templates. Site-specific correction of a point mutation causing a monogenic disease in autologous hematopoietic stem and progenitor cells (HSPCs) can be used as a treatment of inherited disorders of the blood cells. Sickle cell disease (SCD) is an ideal model to investigate the potential use of gene editing to transvert a single point mutation at the beta-globin locus (HBB). We compared the activity of zinc-finger nucleases (ZFNs) and CRISPR/Cas9 for editing,and homologous donor templates delivered as single-stranded oligodeoxynucleotides (ssODNs),adeno-associated virus serotype 6 (AAV6),integrase-deficient lentiviral vectors (IDLVs),and adenovirus 5/35 serotype (Ad5/35) to transvert the base pair responsible for SCD in HBB in primary human CD34+ HSPCs. We found that the ZFNs and Cas9 directed similar frequencies of nuclease activity. In vitro,AAV6 led to the highest frequencies of homology-directed repair (HDR),but levels of base pair transversions were significantly reduced when analyzing cells in vivo in immunodeficient mouse xenografts,with similar frequencies achieved with either AAV6 or ssODNs. AAV6 also caused significant impairment of colony-forming progenitors and human cell engraftment. Gene correction in engrafting hematopoietic stem cells may be limited by the capacity of the cells to mediate HDR,suggesting additional manipulations may be needed for high-efficiency gene correction in HSPCs.,,,,,,,,,,,,,,,,,,,,,,,,,,,,,,,,,,,,,,,,,,,,,,,,,,,,,,,,,,,,,,,,,,,,,,,,,,,,,,,
NEGATIVE,38262104	Effect of voxelotor on murine bone marrow and peripheral blood with hematopoietic progenitor cell mobilization for gene therapy of sickle cell disease. In preparation for hematopoietic stem cell mobilization and collection,current ex vivo gene therapy protocols for sickle cell disease require patients to undergo several months of chronic red cell transfusion. For health care equity,alternatives to red cell transfusion should be available. We examined whether treatment with GBT1118,the murine analog of voxelotor,could be a safe and feasible alternative to red cell transfusion. We found that 3 weeks of treatment with GBT1118 increased the percentage of bone marrow hematopoietic stem cells and upon plerixafor mobilization,the percentage of peripheral blood hematopoietic stem cells. Our data suggest that voxelotor should be further explored for its potential safety and utility as preparation for hematopoietic stem cell mobilization and collection.,,,,,,,,,,,,,,,,,,,,,,,,,,,,,,,,,,,,,,,,,,,,,,,,,,,,,,,,,,,,,,,,,,,,,,,,,,,,,,,,,,
NEGATIVE,34329381	Murine bone marrow mesenchymal stromal cells have reduced hematopoietic maintenance ability in sickle cell disease. Sickle cell disease (SCD) is characterized by hemolytic anemia,which can trigger oxidative stress,inflammation,and tissue injury that contribute to disease complications. Bone marrow mesenchymal stromal cells (MSCs) tightly regulate hematopoietic stem cell (HSC) homeostasis in health and disease,but their functionality in SCD remains unclear. We identified for the first time that murine SCD MSCs have altered gene signatures,reduced stem cell properties,and increased oxidative stress,due in part to hemolysis. Murine SCD MSCs had lower HSC maintenance ability in vitro and in vivo,as manifested by increased HSC mobilization and decreased HSC engraftment after transplant. Activation of Toll-like receptor-4 through p65 in MSCs further contributed to MSC dysfunction. Transfusions led to an improved MSC and HSC oxidative state in SCD mice. Improving the regulation between MSCs and HSCs has vital implications for enhancing clinical HSC transplantation and gene therapy outcomes and for identification of new molecular targets for alleviating SCD complications.,,,,,,,,,,,,,,,,,,,,,,,,,,,,,,,,,,,,,,,,,,,,,,,,,,,,,,,,,,,,,,,,,,,,,,,,,,,,,,,
NEGATIVE,33514718	Cas9-AAV6 gene correction of beta-globin in autologous HSCs improves sickle cell disease erythropoiesis in mice. CRISPR/Cas9-mediated beta-globin (HBB) gene correction of sickle cell disease (SCD) patient-derived hematopoietic stem cells (HSCs) in combination with autologous transplantation represents a recent paradigm in gene therapy. Although several Cas9-based HBB-correction approaches have been proposed,functional correction of in vivo erythropoiesis has not been investigated previously. Here,we use a humanized globin-cluster SCD mouse model to study Cas9-AAV6-mediated HBB-correction in functional HSCs within the context of autologous transplantation. We discover that long-term multipotent HSCs can be gene corrected ex vivo and stable hemoglobin-A production can be achieved in vivo from HBB-corrected HSCs following autologous transplantation. We observe a direct correlation between increased HBB-corrected myeloid chimerism and normalized in vivo red blood cell (RBC) features,but even low levels of chimerism resulted in robust hemoglobin-A levels. Moreover,this study offers a platform for gene editing of mouse HSCs for both basic and translational research.,,,,,,,,,,,,,,,,,,,,,,,,,,,,,,,,,,,,,,,,,,,,,,,,,,,,,,,,,,,,,,,,,,,,,,,,,,,,,,,,,,,
NEGATIVE,38506770	Ex vivo culture resting time impacts transplantation outcomes of genome-edited human hematopoietic stem and progenitor cells in xenograft mouse models. Ex vivo resting culture is a standard procedure following genome editing in hematopoietic stem and progenitor cells (HSPCs). However,prolonged culture may critically affect cell viability and stem cell function. We investigated whether varying durations of culture resting times impact the engraftment efficiency of human CD34+ HSPCs edited at the BCL11A enhancer,a key regulator in the expression of fetal hemoglobin. We employed electroporation to introduce CRISPR-Cas9 components for BCL11A enhancer editing and compared outcomes with nonelectroporated (NEP) and electroporated-only (EP) control groups. Post-electroporation,we monitored cell viability,death rates,and the frequency of enriched hematopoietic stem cell (HSC) fractions (CD34+CD90+CD45RA- cells) over a 48-hour period. Our findings reveal that while the NEP group showed an increase in cell numbers 24 hours post-electroporation,both EP and BCL11A-edited groups experienced significant cell loss. Although CD34+ cell frequency remained high in all groups for up to 48 hours post-electroporation,the frequency of the HSC-enriched fraction was significantly lower in the EP and edited groups compared to the NEP group. In NBSGW xenograft mouse models,both conditioned with busulfan and nonconditioned,we found that immediate transplantation post-electroporation led to enhanced engraftment without compromising editing efficiency. Human glycophorin A+ (GPA+) red blood cells (RBCs) sorted from bone marrow of all BCL11A edited mice exhibited similar levels of gamma-globin expression,regardless of infusion time. Our findings underscore the critical importance of optimizing the culture duration between genome editing and transplantation. Minimizing this interval may significantly enhance engraftment success and minimize cell loss without compromising editing efficiency. These insights offer a pathway to improve the success rates of genome editing in HSPCs,particularly for conditions like sickle cell disease.,,,,,,,,,,,,,,,,,,,,,,,,,,,,,,,,,,,,,,,,,,,,,,,,,,,,,,,,,,,,,,,,,,,,,,,,,,,,
NEGATIVE,38394231	Sickle Cell Disease in an Older Adult Population: A Retrospective Review of Health Care Resource Utilization. Sickle cell disease (SCD) has a history of health inequity,as patients with SCD are primarily Black and often marginalized from the health care system. Although recent health care and treatment advancements have prolonged life expectancy,it may be insufficient to support the complex needs of the growing population of older adults with SCD. This retrospective study used a cohort (N = 812) of Medicare Advantage beneficiaries 45 years and older (ages: 45-54,55-64,65-74,75-89) with SCD to identify associations of SCD-related complications and comorbidities with emergency department (ED) visits,potentially avoidable ED visits,all-cause hospitalization,and potentially avoidable hospitalizations,2018-2020. The 75-89 age group had lower odds of an ED visit (OR 0.56; 95% CI 0.32-1.00),65-74 age group had lower odds of an ED visit (OR 0.49; 95% CI 0.31-0.78) and hospitalization (OR 0.50; 95% CI 0.31-0.79),compared with the 45-54 age group. Acute chest syndrome was associated with increased odds of an ED visit (OR 2.02; 95% CI 1.10-3.71),avoidable ED visit (OR 1.87; 95% CI 1.14-3.06),and hospitalization (OR 3.61; 95% CI 2.06-6.31). Pain was associated with increased odds of an ED visit (OR 2.64; 95% CI 1.85-3.76),an avoidable ED visit (OR 3.08; 95% CI 1.90-4.98),hospitalization (OR 1.51; 95% CI 1.02-2.24),and avoidable hospitalization (OR 6.42; 95% CI 1.74-23.74). Older adults with SCD have been living with SCD for decades,often while managing pain crises and complications associated increased incidence of an ED visit and hospitalization. The characteristics and needs of this population must continue to be examined to increase preventative care and reduce costly emergent health care resource utilization.,,,,,,,,,,,,,,,,,,,,,,,,,,,,,,,,,,,,,,,,,,,,,,,,,,,,,,,,,,,,,,,,,,,,,,
NEGATIVE,"38082534	""Hoping for a normal life: Decision-making on hematopoietic stem cell transplantation by patients with a hemoglobinopathy and their caregivers. BACKGROUND: To provide insight into the perspectives of children and young adults with transfusion-dependent thalassemia and sickle cell disease and their caregivers regarding the decision for hematopoietic stem cell transplantation (HSCT). PROCEDURE: A qualitative longitudinal multicenter study. Data collection consisted of 40 audio-recorded conversations between physicians and families and 77 interviews with patients and/or caregivers related to 27 unique cases","collected at different time points throughout the decision-making process. RESULTS: Conversations and interviews revealed """"hoping for a normal life"""" as an overarching theme","consisting of four main topics: (i) """"Building a frame of reference"""" refers to a process where patients or families try to obtain comprehensive information on HSCT and translate this to their situation to decide. (ii) """"Balancing between loss and benefit"""" reports the process of considering the advantages and disadvantages of continuing with supportive care to treat their disease versus choosing HSCT. (iii) """"Experiencing the impact of HSCT"""" describes the impactfull experience of the HSCT period by those who chose HSCT. (iv) """"Balancing again"""" refers to reflecting on the decision made. CONCLUSIONS: The hope for a normal life guided the decision-making process",described as a constant balance between the impact of the disease and HSCT. A structured approach to explore patients' and caregivers' perspectives on HSCT decision-making is needed,"where specifically discussing the impact of the disease and hope for a normal life need to be integrated in the process.""",,,,,,,,,,,,,,,,,,,,,,,,,,,,,,,,,,,,,,,,,,,,,,,,,,,,,,,,,,,,,,,,,,,,,,,,,,,,,,,,,,,
NEGATIVE,30371676	Intravenous and Intra-amniotic In Utero Transplantation in the Murine Model. In utero transplantation (IUT) is a unique and versatile mode of therapy that can be used to introduce stem cells,viral vectors,or any other substances early in the gestation. The rationale behind IUT for therapeutic purposes is based on the small size of the fetus,the fetal immunologic immaturity,the accessibility and proliferative nature of the fetal stem or progenitor cells,and the potential to treat a disease or the onset of symptoms prior to birth. Taking advantage of these normal developmental properties of the fetus,the delivery of hematopoietic stem cells (HSC) via an IUT has the potential to treat congenital hematologic disorders such as sickle cell disease,without the required myeloablative or immunosuppressive conditioning required for postnatal HSC transplants. Similarly,the accessibility of progenitor cells in multiple organs during development potentially allows for a more efficient targeting of stem/progenitor cells following an IUT of viral vectors for gene therapy or genome editing. Additionally,IUT can be used to study normal developmental processes including,but not limited to,the development of immunologic tolerance. The murine model provides a valuable and affordable means to understanding the potential and limitations of IUT prior to pre-clinical large animal studies and an eventual clinical application. Here,we describe a protocol for performing an IUT in the murine fetus through intravenous and intra-amniotic routes. This protocol has been used successfully to elucidate the necessary conditions and mechanisms behind in utero hematopoietic stem cell transplantation,tolerance induction,and in utero gene therapy.,,,,,,,,,,,,,,,,,,,,,,,,,,,,,,,,,,,,,,,,,,,,,,,,,,,,,,,,,,,,,,,,,,,,,,,,,
NEGATIVE,36669729	Sickle Cell Trevor Thompson Transition Project (ST3P-UP) protocol for managing care transitions: Methods and rationale. BACKGROUND: Emerging adults with sickle cell disease (EASCD) experience significant challenges transitioning from pediatric to adult care. Acute care utilization increases,quality of life (QOL) declines,with an increased risk of mortality. Currently,there are no practice standards to guide emerging adults through the transition process. We are creating a structured transition education (STE) based program for EASCD by customizing the Six Core Elements (6 CE) of Health Care Transition model and are evaluating the effectiveness of adding peer mentoring (PM). METHODS: The Sickle Cell Trevor Thompson Transition Project (ST3P-UP) is an ongoing multi-site,cluster randomized clinical trial with a target enrollment of 537 EASCD aged 16 to 25 years in pediatric care. Each site (n = 14) comprises a pediatric clinic,adult clinic,and a sickle cell disease (SCD) community-based organization (CBO). Sites are randomized 1:1 to either STE or STE + PM. EASCDs are followed prospectively for 24 months. Rapid cycle plan-do-study-act quality improvement (QI) methods are used to implement the STE. The primary objective is to compare the effectiveness of STE + PM versus STE only at decreasing the number of acute care visits per year over 24 months. The secondary objectives are to compare overall healthcare utilization and patient-reported QOL outcomes at 24 months. CONCLUSION: We aim to demonstrate the feasibility of using a QI approach to implement 6 CE-based practice standards at 14 disparate SCD clinical programs to guide EASCD through the transition process. We hypothesize that adding PM to the STE program will improve acute care reliance,QOL,and satisfaction with transition outcomes.,,,,,,,,,,,,,,,,,,,,,,,,,,,,,,,,,,,,,,,,,,,,,,,,,,,,,,,,,,,,,,,,,,,,,,,,,,,,,,,
NEGATIVE,28617328	The Long-Term Consumption of Oats in Celiac Disease Patients Is Safe: A Large Cross-Sectional Study. A strict gluten-free diet (GFD) can be diversified by non-contaminated oats,but there is a shortage of long-term studies concerning its safety. We compared long-term treatment outcomes and factors associated with the introduction of oats between celiac patients on a GFD with or without oats. Eight hundred sixty-nine previously diagnosed celiac patients were interviewed. The validated Gastrointestinal Symptom Rating Scale (GSRS),Psychological General Well-Being (PGWB),and Short-Form 36 Health Survey (SF-36) questionnaires were used to assess symptoms and quality of life,serological tests were performed,and results of histology were confirmed from patient records. We found the median duration of GFD to be 10 years and 82% using oats. Factors predicting the consumption of oats were diagnosis after the year 2000,advice from a dietitian,detection by screening,and mild clinical presentation. Oat consumers and non-consumers did not differ in dietary adherence (96.5% vs. 97.4%,p = 0.746),the prevalence of symptoms (22.9% vs. 22.5%,p = 0.931),positivity for endomysial antibodies (8.8% vs. 6.0%,p = 0.237),histological recovery after one year (63.1% vs. 60.0%,p = 0.773),malignancy (4.8% vs. 3.3%,p = 0.420),osteoporosis/osteopenia (9.2% vs. 11.0%,p = 0.489),or fractures (26.9% vs. 27.9%,p = 0.791). The oat consumers had better SF-36 physical role limitations and general health scores. Based on our results,the long-term consumption of oats in celiac disease patients is safe and may improve quality of life.,,,,,,,,,,,,,,,,,,,,,,,,,,,,,,,,,,,,,,,,,,,,,,,,,,,,,,,,,,,,,,,,,
NEGATIVE,32146601	Gynecological Disorders in Patients with Non-celiac Wheat Sensitivity. BACKGROUND: Non-celiac wheat sensitivity (NCWS) most frequently presents clinically with irritable bowel syndrome (IBS)-like symptoms,although many extra-intestinal manifestations have also been attributed to it. No studies to date have evaluated the presence and frequency of gynecological symptoms in NCWS. AIM: To evaluate the frequency of gynecological disorders in patients with NCWS. PATIENTS AND METHODS: Sixty-eight women with NCWS were included in the study. A questionnaire investigating gynecological symptoms and recurrent cystitis was administered,and patients reporting symptoms were then examined by specialists. Three control groups were selected: 52 patients with IBS not related to NCWS,56 patients with celiac disease (CD),and 71 healthy controls. RESULTS: 59% of the patients with NCWS showed gynecological symptoms,a higher frequency than in healthy controls (P = 0.04),IBS controls (P = 0.01) and CD controls (P = 0.02). Menstrual cycle alterations were more frequent in patients with NCWS than in healthy controls (26.5% vs 11.3%; P = 0.03); the patients with NCWS suffered from recurrent vaginitis (16%) and dyspareunia (6%) significantly more frequently than healthy controls. Twenty-nine percent of patients with NCWS reported recurrent cystitis,a finding higher than in the control groups (vs healthy P = 0.0001,vs IBS P = 0.001,vs CD controls P = 0.04). Microbiological examinations were negative in most of the patients with NCWS and recurrent vaginitis or cystitis. During the 1-year follow-up,46% of patients with menstrual disorders and 36% with recurrent vaginitis reported resolution of symptoms on a wheat-free diet. CONCLUSIONS: Patients with NCWS showed a significantly higher frequency of gynecological symptoms and recurrent cystitis than patients with IBS.,,,,,,,,,,,,,,,,,,,,,,,,,,,,,,,,,,,,,,,,,,,,,,,,,,,,,,,,,,,,,,,,,,,,,,,,,,,,,
NEGATIVE,32425731	COVID-19 pandemic perception in adults with celiac disease: an impulse to implement the use of telemedicine. Background: Coronavirus Disease 2019 (COVID-19) causes severe complications and deaths all over the world. COVID-19 also has indirect effects from the lockdown and the possible lack of food. We aimed to evaluate the perception of this in Celiac Disease (CeD) patients who require a lifelong gluten-free diet as a therapy. Methods: We invited by e-mail CeD adult patients from the University of Salerno (Campania,South Italy) and the University of Padua (Veneto,North Italy) to answer an ad hoc COVID-19 survey. Results: We sent the web survey to 651 email addresses and we received 276 answers (42,4%). CeD patients did not feel more vulnerable because they had CeD (not at all 56.6%) and they did not worry much about the possible shortness of gluten-free food during the epidemic (not at all 48.5%). The most worried were the elderly patients,patients with other comorbidities and females. Finally,CeD patients were happy with remote consultations and explicitly asked to have them. Discussion: The COVID-19 pandemic has impacted a proportion of patients with CeD; in particular,women,elderly patients,patients with other comorbidities. COVID-19,although a challenging experience from the medical and the psychological point of view,has offered an opportunity to practice,on a large-scale,a remote consultation approach for CeD healthcare.,,,,,,,,,,,,,,,,,,,,,,,,,,,,,,,,,,,,,,,,,,,,,,,,,,,,,,,,,,,,,,,,,,,,,,,,,,,
NEGATIVE,35129887	[Cereal related complaints in children]. There's a lot of attention for gluten-free diets on social media. Doctors get many questions about gluten sensitivity or possible wheat allergy. With some basic knowledge,it's easier to give answers to these questions and to prevent unnecessary and sometimes harmful diets. This article gives basic information about cereals,gluten,grasses and their crossreactivity. We give an overview about the differences between celiac disease,gluten sensitivity and IgE-mediated wheat allergy. We also describe diagnostics,treatment and natural history of coeliakie,gluten sensitivity and wheat or cereal allergy.,,,,,,,,,,,,,,,,,,,,,,,,,,,,,,,,,,,,,,,,,,,,,,,,,,,,,,,,,,,,,,,,,,,,,,,,,,,,,,,,,
